,tweet,clean_tweet
1300,"Watch: Lionel Messi’s wife Antonela Roccuzzo and sons celebration after Argentina captain’s goal vs Mexico is pure gold

https://t.co/jB79WzavcI

PLEASE FOLLOW US FOR LIVE ACCURATE NEWS

TWITTER: https://t.co/mkkMtLBNuj
INSTAGRAM: https://t.co/l2bxqE2rMo
FACEBOOK: ... https://t.co/zhlbtFCg4v",Watch Lionel Messi wife Antonela Roccuzzo sons celebration Argentina captain goal vs Mexico pure gold tco jB WzavcIPLEASE FOLLOW US FOR LIVE ACCURATE NEWSTWITTER tco mkkMtLBNujINSTAGRAM tco l bxqE rMoFACEBOOK tco zhlbtFCg v
1301,@fulviogiuliani Personaggio costruito libero di tifare Argentina ma nn in telecronaca Rai poi con la bandiera Argentina sulla spalla,fulviogiuliani Personaggio costruito libero di tifare Argentina nn telecronaca Rai poi con la bandiera Argentina sulla spalla
1302,"@Daviszz5 @GattiIgnacio @elrako12 @Br3ndafab33 @estefiberardi En realidad se va la gente de escasos recursos, yo por eso sigo aquí, con estudios y un salario que le daría de comer a medio Argentina",Daviszz GattiIgnacio elrako Br ndafab estefiberardi En realidad se va la gente de escasos recursos yo por eso sigo aquí con estudios un salario que le daría de comer medio Argentina
1303,"@Eliza_Oreyes No se habla, no se.lo conoce.a canelo en argentina
Por eso te.puse.q messi ni debe saber quien lo esta amenazando
Saludos.",Eliza_Oreyes No se habla selo conocea canelo en argentinaPor eso tepuseq messi ni debe saber quien lo esta amenazandoSaludos
1304,"@FannysPax @Emilianoone37 @arturiano33 Enserio las prostitutas de EEUU creen que argentina no comen jajajaja
Estos hptas como no pueden en fútbol les toca usar otra cosa.
Con razón sigue ese narco estado.",FannysPax Emilianoone arturiano Enserio las prostitutas de EEUU creen que argentina comen jajajajaEstos hptas como pueden en fútbol les toca usar otra cosaCon razón sigue ese narco estado
1305,"@SebaRiver0 Jajaja si claro en finales estamos empatados y en selecciones menores México tiene PATERNIDAD sobre Argentina, no me creas revisa los números 😂

Ya deja de hablar del partido por qué demuestras que ganarle a México para ustedes representa ganar un mundial 😂",SebaRiver Jajaja si claro en finales estamos empatados en selecciones menores México tiene PATERNIDAD sobre Argentina creas revisa los números Ya deja de hablar del partido por qué demuestras que ganarle México para ustedes representa ganar un mundial
1306,"Não tenho nd contra o Richarlison, mas compará-lo ao Jesus é falta de noção. 

Patamares diferentes.

GJ destruiu a Argentina na semifinal e fez gol na final da Copa América em 2019, enquanto o Brasil com Richarlison em campo perdeu a final pra Argentina dentro do Maraca em 2021.",Não tenho nd contra Richarlison mas compará lo ao Jesus é falta de noção Patamares diferentesGJ destruiu Argentina na semifinal e fez gol na final da Copa América em enquanto Brasil com Richarlison em campo perdeu final pra Argentina dentro Maraca em
1307,"@aumo91 @tendenciasposta Clasico de Argentina es Brasil, Uruguay, Inglaterra, Alemania y Portugal. ¿Que mierda flasheaste?",aumo tendenciasposta Clasico de Argentina es Brasil Uruguay Inglaterra Alemania Portugal Que mierda flasheaste
1308,"@stevenarce Hola @stevenarce recuerdo qué en el programa de ESPN siempre estuviste con Argentina cómo favorito , y se te pregunto por un segundo candidato y dijiste Brasil. Fuerte abrazo",stevenarce Hola stevenarce recuerdo qué en el programa de ESPN siempre estuviste con Argentina cómo favorito se te pregunto por un segundo candidato dijiste Brasil Fuerte abrazo
1309,@marceloburgosf Prefiero que gane Brasil a que gane Argentina 🤣🇧🇷,marceloburgosf Prefiero que gane Brasil que gane Argentina
1310,"Y'all should be more empathetic with this person, it must be very difficult not to have a good education system that teaches you more than one language. Btw Argentina is ranked No. 1 among Latin American countries with the best level of English. https://t.co/nhCQGlu3M1",Y empathetic person must difficult good education system teaches one language Btw Argentina ranked No among Latin American countries best level English tco nhCQGlu M
1311,"Espero que cone sta cuenta haya probado un poco de lo simplista q es decir q argentina es racista. Y como tiene tintes de ""white savior complex"".",Espero que cone sta cuenta haya probado un poco de lo simplista q es decir q argentina es racista Y como tiene tintes de white savior complex
1312,"@Uruguay Vamos la celeste, desde Argentina bancando!!!",Uruguay Vamos la celeste desde Argentina bancando
1313,"@mauro_sks Maracanazo ai se vê a mediocridade desses patéticos fracassados 😂😂😂 enquanto pro Brasil ganhar da patética argentina é só mais um jogo comum, no dia que você ver tua patética argentina ganhar uma dessa volta aqui 🤣🤣🤣🤣 https://t.co/WrRtTkY1ph",mauro_sks Maracanazo ai se vê mediocridade desses patéticos fracassados enquanto pro Brasil ganhar da patética argentina é só mais um jogo comum dia que você ver tua patética argentina ganhar uma dessa volta aqui tco WrRtTkY ph
1314,Brazilian people who root for Argentina deserve to pay double the rent! https://t.co/wSz0nPagcA,Brazilian people root Argentina deserve pay double rent tco wSz nPagcA
1315,"@Canelo cómo sabes qué es la playera de México qué tal y 
si otra tela color verde o de plano todavía están ardidos
algunos mexicanos por la derrota ante argentina.",Canelo cómo sabes qué es la playera de México qué tal si otra tela color verde de plano todavía están ardidosalgunos mexicanos por la derrota ante argentina
1316,"@itzyday1 La verdadera pregunta es, qué hacía la playera de México dentro del vestidor de argentina 🤨",itzyday La verdadera pregunta es qué hacía la playera de México dentro del vestidor de argentina
1317,"@thorgfd que venha Portugal, na semi a Argentina e na final a frança, hexa eliminando CR7, Messi e Mbappe",thorgfd que venha Portugal na semi Argentina e na final frança hexa eliminando CR Messi e Mbappe
1318,https://t.co/Bi8JN0ek0n,tco Bi JN ek n
1319,"📂 Wallpapers
 └🛡️ #FIFAWorldCup 
      └🇦🇷 Argentina https://t.co/DNn1Xl8rpa",Wallpapers FIFAWorldCup Argentina tco DNn Xl rpa
1320,@_Moon_w2_ @Robaninhos Argentinos en argentina /mejicanos en mexico https://t.co/M4YW8UwKzM,_Moon_w _ Robaninhos Argentinos en argentina mejicanos en mexico tco M YW UwKzM
1321,vai toma no cu Argentina! https://t.co/y1U1h1ZzMU,vai toma cu Argentina tco U h ZzMU
1322,NOW THE WEEKND IS COMING TO ARGENTINA i really manifested hard wow https://t.co/TUXPzpXcfG,NOW THE WEEKND IS COMING TO ARGENTINA really manifested hard wow tco TUXPzpXcfG
1323,@bitterensweet argentina desse tamanico aqui ó 🤏🏻 e tem quantos títulos mesmo? só pra lembrar 🤭,bitterensweet argentina desse tamanico aqui ó e tem quantos títulos mesmo só pra lembrar
1324,"Lo de México y Argentina aquí en Twitter es realmente ridículo. Empezando por los ""chistes"" racistas, siguiendo por MÉXICO ninguneando la economía argentina XD y lo del ridículo de Canelo...",Lo de México Argentina aquí en Twitter es realmente ridículo Empezando por los chistes racistas siguiendo por MÉXICO ninguneando la economía argentina XD lo del ridículo de Canelo
1325,"@juanivarelaa @tendenciasposta No todas maneja la jerga argentina , ni saben lo que significa ""posta"" 😂 debe ser por eso",juanivarelaa tendenciasposta No todas maneja la jerga argentina ni saben lo que significa posta debe ser por eso
1326,"@ElTanqueHurtado Pienso igual tocayo, Ecuador juega bien esperemos que no decaiga su juego, Brasil y Argentina aún pueden dar mucho más 💪",ElTanqueHurtado Pienso igual tocayo Ecuador juega bien esperemos que decaiga su juego Brasil Argentina aún pueden dar mucho más
1327,"@Canelo Sos un fantasma @cancelo bien que antes de que se juegue el partido salian videos burlandose de la argentia y las malvinas, asi que ahora... A LLORAR AL CAMPITO AGUANTE ARGENTINA",Canelo Sos un fantasma cancelo bien que antes de que se juegue el partido salian videos burlandose de la argentia las malvinas asi que ahora A LLORAR AL CAMPITO AGUANTE ARGENTINA
1328,"Argentina é igual avalanche, só faltou 1......",Argentina é igual avalanche só faltou
1329,"Jajaja que haya gente que le echa la culpa al portero, Messi es un fenómeno y si lo dejas tirar la pone donde quiere.
México pierde porque Argentina es infinitamente mejor y tiene jugadores de una calidad infinitamente mejores https://t.co/tRTWx16AR1",Jajaja que haya gente que le echa la culpa al portero Messi es un fenómeno si lo dejas tirar la pone donde quiereMéxico pierde porque Argentina es infinitamente mejor tiene jugadores de una calidad infinitamente mejores tco tRTWx AR
1330,@Argentina qué bellezaaaaaaaa 😍😍😍😍,Argentina qué bellezaaaaaaaa
1331,@LucianiAriel 4 veces campeon del mundo con Argentina?... Tiene 4 estrellas entonces.,LucianiAriel veces campeon del mundo con Argentina Tiene estrellas entonces
1332,@blasitobjs @Mario___RM Argentina 😹,blasitobjs Mario___RM Argentina
1333,"Acaba de publicar una foto en Junín, Mendoza, Argentina https://t.co/QetLxhf0Gw",Acaba de publicar una foto en Junín Mendoza Argentina tco QetLxhf Gw
1334,"@die_mannschaft5 @vkvrly @CoachJustinL Lebih optimis ke Argentina sih,.. klo Londo ga tau jugaaa tergantung liat lawannya siapa",die_mannschaft vkvrly CoachJustinL Lebih optimis ke Argentina sih klo Londo ga tau jugaaa tergantung liat lawannya siapa
1335,Germany and Argentina are yet to book their places either; don’t count the Saudi’s out too,Germany Argentina yet book places either count Saudi
1336,essa foto é maior q a argentina https://t.co/kmlhACMXWm,essa foto é maior q argentina tco kmlhACMXWm
1337,Eva Perón: la historia de la amada ‘Evita’ de Argentina https://t.co/5kNmtiDz3E,Eva Perón la historia de la amada Evita de Argentina tco kNmtiDz E
1338,"La Brasil de 2018 era mucho mejor que ésta, como les hizo falta Neymar para que siquiera intentara algo de verdad. Si Argentina no está para campeón como dicen, Brasil tampoco.",La Brasil de era mucho mejor que ésta como les hizo falta Neymar para que siquiera intentara algo de verdad Si Argentina está para campeón como dicen Brasil tampoco
1339,"@NunaLopes2 Dividir o brasil jamais  mandar 1/5 de cada comunista para venezuela, Cuba Argentina Chile e Colômbia. Querem ser comunistas vão para lá logo",NunaLopes Dividir brasil jamais mandar de cada comunista para venezuela Cuba Argentina Chile e Colômbia Querem ser comunistas vão para lá logo
1340,"@AlexFraile28 @Fidel92746445 @LuisAndres33 @EmmanuelR727 @OscarLa19140959 @renacova No,igual también pierde la selección,
Pero imagina la y expertis que tendrían estos chavos?
Y te aseguro que le hacen más juego a argentina y le pones más amor,
Porque no están viciados !!!
Mira a España, es un ejemplo de transición",AlexFraile Fidel LuisAndres EmmanuelR OscarLa renacova Noigual también pierde la selecciónPero imagina la expertis que tendrían estos chavos Y te aseguro que le hacen más juego argentina le pones más amorPorque están viciados Mira España es un ejemplo de transición
1341,"@agustinamente @Canelo Son bien pelotudos, se meten con las Malvinas un tema demasiado fuerte para la Argentina, y ahora chillan cm niñitas xq la playerita tocó suelo, q se aguanten ahora, pelotudos, ni respétan, pero bien q quieren q los respeten a ellos, la concha d su madre pelotudos 🖕🏼🙄",agustinamente Canelo Son bien pelotudos se meten con las Malvinas un tema demasiado fuerte para la Argentina ahora chillan cm niñitas xq la playerita tocó suelo q se aguanten ahora pelotudos ni respétan pero bien q quieren q los respeten ellos la concha su madre pelotudos
1342,"Ué! não pode? Eu torço para a Argentina , Uruguai e que para quem eu quiser. https://t.co/1z4TSYUfZn",Ué não pode Eu torço para Argentina Uruguai e que para quem eu quiser tco z TSYUfZn
1343,@SomosAnalistas_ Y quererle ganará a argentina con DT argentino si???,SomosAnalistas _ Y quererle ganará argentina con DT argentino si
1344,"Estoy tranquilo y de la nada mi cabeza:

_En Argentina nací🇦🇷, tierra de Diego y Lionel, de los pibes de Malvinas🗺 que jamás olvidare. No te lo puedo explicar, porque no vas a entender las finales que perdimos cuantos años las llore, pero eso se terminó...",Estoy tranquilo de la nada mi cabeza_En Argentina nací tierra de Diego Lionel de los pibes de Malvinas que jamás olvidare No te lo puedo explicar porque vas entender las finales que perdimos cuantos años las llore pero eso se terminó
1345,"@ladyofkythera @brujadotgov @SavageKp @NoContextBrits Time has told.
What has happened in the 40 years since the war?  Has Argentina made *any* progress?",ladyofkythera brujadotgov SavageKp NoContextBrits Time toldWhat happened years since war Has Argentina made progress
1346,"@ILoveOchentas Indudablemente la mejor canción que identifica a un mundial, inolvidable Italia 90. Con Diego Armando Maradona defendiendo a Argentina cuando los italianos silbaban el himno argentino. https://t.co/BFNHJUlPiY",ILoveOchentas Indudablemente la mejor canción que identifica un mundial inolvidable Italia Con Diego Armando Maradona defendiendo Argentina cuando los italianos silbaban el himno argentino tco BFNHJUlPiY
1347,"@elopezmota Antes del partido del TRI vs Argentina, me atreví a pronosticar una penal a favor de @miseleccionmx por sus ofensivos ágiles y veloces. Pero pues ni pisaron el área rival y como dijo Don Boni, ""esta kbrn marcar una penal a favor, en la media cancha"".",elopezmota Antes del partido del TRI vs Argentina atreví pronosticar una penal favor de miseleccionmx por sus ofensivos ágiles veloces Pero pues ni pisaron el área rival como dijo Don Boni esta kbrn marcar una penal favor en la media cancha
1348,@Raw0ol 2nd Saudi goal v Argentina is up there,Raw ol nd Saudi goal v Argentina
1349,"Aplica a Varios Países
#Argentina https://t.co/8DTygOaQze",Aplica Varios Países Argentina tco DTygOaQze
1350,"@Msosa2333Sosa @isydrox @Mancuer91 A diferencia de usted, yo me informó primero tonto. Aquí está, lea, 
https://t.co/z0Q2bnZzEg",Msosa Sosa isydrox Mancuer A diferencia de usted yo informó primero tonto Aquí está lea tco z Q bnZzEg
1351,@FinoYossen @Argentina https://t.co/1vrgfSlMMy,FinoYossen Argentina tco vrgfSlMMy
1352,"@Faitelson_ESPN Cierra el hocico defensor de animales, mereces unas cachetadas Guajoloteras como las que te dio  el gran Cuauhtemoc. Ustedes siempre justificando las acciones de gente que insulta a la gran patria Mexico. Incluso el presidente de argentina insulto a Mexico e igual lo defiendesn.",Faitelson_ESPN Cierra el hocico defensor de animales mereces unas cachetadas Guajoloteras como las que te dio el gran Cuauhtemoc Ustedes siempre justificando las acciones de gente que insulta la gran patria Mexico Incluso el presidente de argentina insulto Mexico e igual lo defiendesn
1353,"@eltroll83 @DonShelby__ Bajo ese argumento, UEFA sin Italia, Alemania, Francia, España e Inglaterra... No gabaria ningún mundial.. Los ganaría Argentina o Brasil. Son discusiones esteriles",eltroll DonShelby __ Bajo ese argumento UEFA sin Italia Alemania Francia España e Inglaterra No gabaria ningún mundial Los ganaría Argentina Brasil Son discusiones esteriles
1354,"@FIFAcom @Argentina I am Form Bangladesh... 
I Love messi... 
Bangladesh every people Lionel messi fans",FIFAcom Argentina I Form Bangladesh I Love messi Bangladesh every people Lionel messi fans
1355,@Canelo Deja de amenazar Bocón!!! Vení a Argentina!!! TODOS SOMO MESSI!!!,Canelo Deja de amenazar Bocón Vení Argentina TODOS SOMO MESSI
1356,"@makingclipping @ErYayodiyei @qdestra_1 @Qeilev @Prankedyy Jajaj se enojan cuando Messi ""patea"" sin querer su camiseta y después insultan a toda la Argentina diciendo que no son humanos, vayan a lavarse bien el orto bld",makingclipping ErYayodiyei qdestra _ Qeilev Prankedyy Jajaj se enojan cuando Messi patea sin querer su camiseta después insultan toda la Argentina diciendo que son humanos vayan lavarse bien el orto bld
1357,Defante paralisando após fazer teco teco do birubiru com uma argentina https://t.co/0nNHoFGIsK,Defante paralisando após fazer teco teco birubiru com uma argentina tco nNHoFGIsK
1358,i wanna watch saudi vs argentina match again,wanna watch saudi vs argentina match
1359,argentinos are the most racist people ever and y’all deserve nothing but disgrace #WorldCup2022 #Brazil #argentina #messi,argentinos racist people ever deserve nothing disgrace WorldCup Brazil argentina messi
1360,"Café frío grande, con una bocha de helado, una porción de cheese cake 4USD argentina es el mejor país del mundo https://t.co/8Ypj5Di2Xw",Café frío grande con una bocha de helado una porción de cheese cake USD argentina es el mejor país del mundo tco Ypj Di Xw
1361,"La verdad no me sorprende esto, el negocio del tatuaje en Argentina se sustenta con clientes como ella https://t.co/Ctp0snakSh",La verdad sorprende esto el negocio del tatuaje en Argentina se sustenta con clientes como ella tco Ctp snakSh
1362,"@Canelo AHI TENES LA PLAYERA LA C******NCHA DE TU MADRE.PARA LO UNICO Q SIRVE ESE TRAPO MUGROSO, TE DUELE EL OGT TODAVIA NO??? LA AGITAN ANTES DE LOS PARTIDOS Y DSP NO SE LA AGUANTAN VENI A ARGENTINA A VER SI TE LA BANCAS CAG**N https://t.co/aIWdpFJn7i",Canelo AHI TENES LA PLAYERA LA C NCHA DE TU MADREPARA LO UNICO Q SIRVE ESE TRAPO MUGROSO TE DUELE EL OGT TODAVIA NO LA AGITAN ANTES DE LOS PARTIDOS Y DSP NO SE LA AGUANTAN VENI A ARGENTINA A VER SI TE LA BANCAS CAG N tco aIWdpFJn
1363,@FIFAWorldCup France have a high chance to get a match with Argentina/poland 🇵🇱!? Whom you prefer!?,FIFAWorldCup France high chance get match Argentina poland Whom prefer
1364,"@ElGolGarracol Argentina y Francia no tendrían mundial , Colombia hubiera accedido a una semifinal de un mundial, barca mi amor energía varias Champions, etc etc",ElGolGarracol Argentina Francia tendrían mundial Colombia hubiera accedido una semifinal de un mundial barca mi amor energía varias Champions etc etc
1365,@monicareall_ Argentina ttp dihati indonesia dalm hati. Diluar hati woow mantap,monicareall _ Argentina ttp dihati indonesia dalm hati Diluar hati woow mantap
1366,@ccandelabro_ callate que viene a Argentina,ccandelabro _ callate que viene Argentina
1367,yo todavia no logro entender en que nos representa coscu o momo para que vayan a qatar a ser la vos de argentina,yo todavia logro entender en que nos representa coscu momo para que vayan qatar ser la vos de argentina
1368,"@nafizasolei No bro,tho I am Argentina supporter . Neymar is Neymar",nafizasolei No brotho I Argentina supporter Neymar Neymar
1369,@Lupo55 La transformación fue convertir a la Argentina en una gran villa narco.,Lupo La transformación fue convertir la Argentina en una gran villa narco
1370,"@arielipillo ¿Tan preocupados están por Messi y una camiseta?
Deberían estar así de preocupados y ocupados en levantar su nivel de fútbol que está más tirado abajo que esa camiseta...dos le hizo una Argentina que jugó horrible, imagínate si jugaban bien.",arielipillo Tan preocupados están por Messi una camiseta Deberían estar así de preocupados ocupados en levantar su nivel de fútbol que está más tirado abajo que esa camisetados le hizo una Argentina que jugó horrible imagínate si jugaban bien
1371,"Amor por ambas selecciones 

🇧🇷Brasil en 8vos
🇦🇷Argentina el miércoles con todo

Messi 😍😍😍😍
Neymar 😍😍😍
Ronaldo 😍😍😍 https://t.co/WDhkq817uW",Amor por ambas selecciones Brasil en vos Argentina el miércoles con todoMessi Neymar Ronaldo tco WDhkq uW
1372,"@obesinho @nicolas5635 @femiputitas @RominaCaliva4 @gonzaloco1 El mandamas de tanto mexico como de argentina son inutiles y es imposible negarlos pero lo q dijo alberto no esta tan mal,ya q solo 2 millones de argentinos descienden 100% de pueblos originarios y el resto son o mestisos o 100% europeos",obesinho nicolas femiputitas RominaCaliva gonzaloco El mandamas de tanto mexico como de argentina son inutiles es imposible negarlos pero lo q dijo alberto esta tan malya q solo millones de argentinos descienden de pueblos originarios el resto son mestisos europeos
1373,"@daniellachavezc Si te informas un poco en la historia del futbol, Mexico nunca supero a Argentina!este partido no iba a ser la excepción!",daniellachavezc Si te informas un poco en la historia del futbol Mexico nunca supero Argentina este partido iba ser la excepción
1374,"@losprota Ya que se acabe , mejor pierdan por default. Se los dije que no se presentaran vs Argentina 🤣",losprota Ya que se acabe mejor pierdan por default Se los dije que se presentaran vs Argentina
1375,"Por ahora , estas serían las llaves de 8vos de final si hoy terminara la fase de grupos. 
Faltan jugar Uruguay vs Portugal para terminar la segunda fecha y mañana se definen los grupos A y B. 
Argentina si termina primero jugaría el 3/12 a las 16hs y si termina 2do el 4/12 12hs https://t.co/HuVm1SdlYL",Por ahora estas serían las llaves de vos de final si hoy terminara la fase de grupos Faltan jugar Uruguay vs Portugal para terminar la segunda fecha mañana se definen los grupos A B Argentina si termina primero jugaría el las hs si termina el hs tco HuVm SdlYL
1376,@AnonymousLeakMX @crenfige @EmpatiaNo @maflorencia_a lo que no descubrieron fue como ganarle a la selección argentina,AnonymousLeakMX crenfige EmpatiaNo maflorencia_a lo que descubrieron fue como ganarle la selección argentina
1377,"@FinoYossen @Argentina https://t.co/d0Z35xfzIJ

https://t.co/FHFjqWGtBU

https://t.co/FMgDcdBS3O

https://t.co/AKUXuVtSGo

https://t.co/nn991sscWf

https://t.co/8ngDtFmrXa",FinoYossen Argentina tco Z xfzIJ tco FHFjqWGtBU tco FMgDcdBS O tco AKUXuVtSGo tco nn sscWf tco ngDtFmrXa
1378,"@Uruguay Vamooo Uruguay,  desde Argentina siempre con ustedes.",Uruguay Vamooo Uruguay desde Argentina siempre con ustedes
1379,"@marcedePqueChas Hola Buenas tardes,Contáctanos por esté medio para ayudarte con tu inconveniente Déjanos tú número de teléfono para que un Ejecutivo de cuenta se comunique con usted Mastercard Argentina.",marcedePqueChas Hola Buenas tardesContáctanos por esté medio para ayudarte con tu inconveniente Déjanos tú número de teléfono para que un Ejecutivo de cuenta se comunique con usted Mastercard Argentina
1380,@SobaoPasiegoo Sobretodo Argentina.,SobaoPasiegoo Sobretodo Argentina
1381,"""Argentina me abrió las puertas, me siento argentino"": niño venezolano que celebró la victoria de la Albiceleste (VIDEO) https://t.co/y4JqTYd6iV",Argentina abrió las puertas siento argentino niño venezolano que celebró la victoria de la Albiceleste VIDEO tco JqTYd iV
1382,"@hotwife339 se que no sos escort, ademas soy de Argentina y creo que el fan numero uno de tus pezones, perdón tuyo",hotwife se que sos escort ademas soy de Argentina creo que el fan numero uno de tus pezones perdón tuyo
1383,"El anfitrión de mi Airbnb es argentino y cuando me despedí le dije ""viva argentina carajo!"" Xddd",El anfitrión de mi Airbnb es argentino cuando despedí le dije viva argentina carajo Xddd
1384,"La Brasil de 2018 era mucho mejor que ésta, como les hizo falta Neymar para que siquiera intentara algo de verdad. Si Argentina no está para campeón como dicen, Brasil tampoco.",La Brasil de era mucho mejor que ésta como les hizo falta Neymar para que siquiera intentara algo de verdad Si Argentina está para campeón como dicen Brasil tampoco
1385,"@NunaLopes2 Dividir o brasil jamais  mandar 1/5 de cada comunista para venezuela, Cuba Argentina Chile e Colômbia. Querem ser comunistas vão para lá logo",NunaLopes Dividir brasil jamais mandar de cada comunista para venezuela Cuba Argentina Chile e Colômbia Querem ser comunistas vão para lá logo
1386,"@AlexFraile28 @Fidel92746445 @LuisAndres33 @EmmanuelR727 @OscarLa19140959 @renacova No,igual también pierde la selección,
Pero imagina la y expertis que tendrían estos chavos?
Y te aseguro que le hacen más juego a argentina y le pones más amor,
Porque no están viciados !!!
Mira a España, es un ejemplo de transición",AlexFraile Fidel LuisAndres EmmanuelR OscarLa renacova Noigual también pierde la selecciónPero imagina la expertis que tendrían estos chavos Y te aseguro que le hacen más juego argentina le pones más amorPorque están viciados Mira España es un ejemplo de transición
1387,"@agustinamente @Canelo Son bien pelotudos, se meten con las Malvinas un tema demasiado fuerte para la Argentina, y ahora chillan cm niñitas xq la playerita tocó suelo, q se aguanten ahora, pelotudos, ni respétan, pero bien q quieren q los respeten a ellos, la concha d su madre pelotudos 🖕🏼🙄",agustinamente Canelo Son bien pelotudos se meten con las Malvinas un tema demasiado fuerte para la Argentina ahora chillan cm niñitas xq la playerita tocó suelo q se aguanten ahora pelotudos ni respétan pero bien q quieren q los respeten ellos la concha su madre pelotudos
1388,"Ué! não pode? Eu torço para a Argentina , Uruguai e que para quem eu quiser. https://t.co/1z4TSYUfZn",Ué não pode Eu torço para Argentina Uruguai e que para quem eu quiser tco z TSYUfZn
1389,@SomosAnalistas_ Y quererle ganará a argentina con DT argentino si???,SomosAnalistas _ Y quererle ganará argentina con DT argentino si
1390,"Estoy tranquilo y de la nada mi cabeza:

_En Argentina nací🇦🇷, tierra de Diego y Lionel, de los pibes de Malvinas🗺 que jamás olvidare. No te lo puedo explicar, porque no vas a entender las finales que perdimos cuantos años las llore, pero eso se terminó...",Estoy tranquilo de la nada mi cabeza_En Argentina nací tierra de Diego Lionel de los pibes de Malvinas que jamás olvidare No te lo puedo explicar porque vas entender las finales que perdimos cuantos años las llore pero eso se terminó
