,tweet,clean_tweet
881,"@L1onFC @monasterioR No se que haran en argentina, aqui en españa, uno de cada 5 negocios es chino, uno de cada 7 es marroqui, el 90% de los rumanos trabajan en el campo, dos de cada diez Ukranianos tiene plantilla de obreros de la construcción...
Y en Sevilla no hubo peleas al finalizar el partido",L onFC monasterioR No se que haran en argentina aqui en españa uno de cada negocios es chino uno de cada es marroqui el de los rumanos trabajan en el campo dos de cada diez Ukranianos tiene plantilla de obreros de la construcciónY en Sevilla hubo peleas al finalizar el partido
882,@goldendriverrs @choquei Bandeira da nanica Argentina no nome = opinião inválida,goldendriverrs choquei Bandeira da nanica Argentina nome opinião inválida
883,@gabrielwinant @irl_neil @feinsod @dennismhogan also wonder if they came to argentina instead ? lotta italian leftists over here in those years,gabrielwinant irl_neil feinsod dennismhogan also wonder came argentina instead lotta italian leftists years
884,"@gaiofact o que aconteceu com a Argentina, do Jovens de Negócios",gaiofact que aconteceu com Argentina Jovens de Negócios
885,@Pontifex_es Te quiero mucho Papa the Argentina,Pontifex_es Te quiero mucho Papa Argentina
886,LO MÁS TIERNO QUE VAS A VER HOY😍 Un nene de dos años se volvió viral tras aprenderse los nombres de todos los jugadores de la Selección Argentina. https://t.co/ulOuNkgvBR,LO MÁS TIERNO QUE VAS A VER HOY Un nene de dos años se volvió viral tras aprenderse los nombres de todos los jugadores de la Selección Argentina tco ulOuNkgvBR
887,"@mathieudurand69 @manuelssssss1 @ESPNRingside @Canelo You live in the Chicago area, right?  Then you should know that the Pol's should not be treated lightly and will come into that game expecting to win!  Argentina will be lucky to get 2 goals vs. Poland.  PS: Saudi Arabia was the worst team in that group, see world rankings...",mathieudurand manuelssssss ESPNRingside Canelo You live Chicago area right Then know Pol treated lightly come game expecting win Argentina lucky get goals vs Poland PS Saudi Arabia worst team group see world rankings
888,"•| Taehyung Argentina |•
CR: taeguide",Taehyung Argentina CR taeguide
889,"A energia caiu UM MINUTO antes do gol do Casemiro. Me senti no filme Rio, assistindo a final da Argentina contra o Brasil.

NeoEnergia filha da puta

DEVOLVE A CEB, IBANEIS LIXO",A energia caiu UM MINUTO antes gol Casemiro Me senti filme Rio assistindo final da Argentina contra BrasilNeoEnergia filha da putaDEVOLVE A CEB IBANEIS LIXO
890,@MessiUK10 Yes just like them Portugal has same intense young supporters but the Argentina has better overall support (both emotional and physical) only because of certain Diego Maradona back in 1980's. I tried to say that Portugal didn't have that impact from long ago.,MessiUK Yes like Portugal intense young supporters Argentina better overall support emotional physical certain Diego Maradona back I tried say Portugal impact long ago
891,THE WEEKEND VIENE A ARGENTINA EL AÑO QUE VIENE 😩😩😩😩😩 OJALA TENER PLATA PARA IR O UN TRABAJO BUENO LQ CONFERENCIA DE LA LORA ARGENTINA,THE WEEKEND VIENE A ARGENTINA EL AÑO QUE VIENE OJALA TENER PLATA PARA IR O UN TRABAJO BUENO LQ CONFERENCIA DE LA LORA ARGENTINA
892,@SofascoreBR Vice da Argentina!,SofascoreBR Vice da Argentina
893,"Los hijos son mexicanos, fassi le hace el aguante a la selección Argentina más que vos, vos no podes hablar, criticaste a messi , sos un pésimo periodista. Que querés venir a tirar mierda a Talleres che culiau. https://t.co/4ygTBqvUkJ",Los hijos son mexicanos fassi le hace el aguante la selección Argentina más que vos vos podes hablar criticaste messi sos un pésimo periodista Que querés venir tirar mierda Talleres che culiau tco ygTBqvUkJ
894,LO MÁS TIERNO QUE VAS A VER HOY😍 Un nene de dos años se volvió viral tras aprenderse los nombres de todos los jugadores de la Selección Argentina. https://t.co/xzWYTrrHa2,LO MÁS TIERNO QUE VAS A VER HOY Un nene de dos años se volvió viral tras aprenderse los nombres de todos los jugadores de la Selección Argentina tco xzWYTrrHa
895,"https://t.co/xfvJTAqezS Miren que encontré! una nota vieja que relaciona a lo ""polaco con #MacriMufa"": de no creer!#MacriMufa
@_LaMaximoK @soyLiliVivero2
#CapuchettiRivoloLPMQLP #LucianiMolaDELINCUENTES #LasCallesNosEsperan",tco xfvJTAqezS Miren que encontré una nota vieja que relaciona lo polaco con MacriMufa de creer MacriMufa_LaMaximoK soyLiliVivero CapuchettiRivoloLPMQLP LucianiMolaDELINCUENTES LasCallesNosEsperan
896,"@ModoCarreraJR1 no se cuanto se le paga al Tata. Yo lo que digo en el tweet y repito es que la culpa no es suya, si tu dudas de un entrenador, échalo. No lo contrates. Hay mil seleccionadores en el mundo. Si dudas de un argentino, y ademas sabes que vas a jugar contra Argentina, pues busca a",ModoCarreraJR se cuanto se le paga al Tata Yo lo que digo en el tweet repito es que la culpa es suya si tu dudas de un entrenador échalo No lo contrates Hay mil seleccionadores en el mundo Si dudas de un argentino ademas sabes que vas jugar contra Argentina pues busca
897,"Venezolana y argentina. 

Coincidencia? 

No lo creo https://t.co/4vEEdWMgA3",Venezolana argentina Coincidencia No lo creo tco vEEdWMgA
898,"Hoy puedo decir que los favoritos para ganar el mundial son: España, Argentina, Francia, Brasil y el Cuenquita",Hoy puedo decir que los favoritos para ganar el mundial son España Argentina Francia Brasil el Cuenquita
899,"essa foto tem mais copas do mundo que a argentina.
(O que não é mt difícil né galera HAHAHA https://t.co/VFSb8WdZpY",essa foto tem mais copas mundo que argentina O que não é mt difícil né galera HAHAHA tco VFSb WdZpY
900,LO MÁS TIERNO QUE VAS A VER HOY😍 Un nene de dos años se volvió viral tras aprenderse los nombres de todos los jugadores de la Selección Argentina. https://t.co/S2QoORV75L,LO MÁS TIERNO QUE VAS A VER HOY Un nene de dos años se volvió viral tras aprenderse los nombres de todos los jugadores de la Selección Argentina tco S QoORV L
901,@lxssarr @1knalhaa e vc q foi pra Argentina ver o time perder pro del valle,lxssarr knalhaa e vc q foi pra Argentina ver time perder pro del valle
902,"Argentina ganó y punto.

Queriendo responsabilizar, cuando la crítica debe ser de acá, de adentro, cuestionar la puta liga de fútbol mediocre y toda la mierda de futbolistas piteros, tanto extranjeros como nacionales. 

Hay que ampliar el horizonte la puta madre!!",Argentina ganó puntoQueriendo responsabilizar cuando la crítica debe ser de acá de adentro cuestionar la puta liga de fútbol mediocre toda la mierda de futbolistas piteros tanto extranjeros como nacionales Hay que ampliar el horizonte la puta madre
903,"Lo lindas que están la mayoría de las camisetas prematch de este mundial, hasta mejores que las de partido diría (salvo Argentina)",Lo lindas que están la mayoría de las camisetas prematch de este mundial hasta mejores que las de partido diría salvo Argentina
904,"@Nsgdmhh @CarlosMaslaton Yo nunca vi ese ""odio"" he ido a vacaiconar a argentina y casi todos los que conozco van, odio hay entre las coreas, es como decir que Brasil y Argentina se odian, es más una rivalidad que se yo, nunca he visto ataques d e odio entre argentinos y uruguayos más que discusiones https://t.co/6dNXDlLJhL",Nsgdmhh CarlosMaslaton Yo nunca vi ese odio ido vacaiconar argentina casi todos los que conozco van odio hay entre las coreas es como decir que Brasil Argentina se odian es más una rivalidad que se yo nunca visto ataques e odio entre argentinos uruguayos más que discusiones tco dNXDlLJhL
905,"Foto trucha pero es verdad que en ese lado del planeta Argentina tiene muchos fans y sí, deberían rendirle honores en agradecimiento. https://t.co/5yLk0rovKu",Foto trucha pero es verdad que en ese lado del planeta Argentina tiene muchos fans sí deberían rendirle honores en agradecimiento tco yLk rovKu
906,@Capone__x @brunoformiga Zebras acontecem. Futebol é isso. Nem sempre o melhor ganha. A Suíça é melhor que a França por que venceu um jogo? O oriente médio é mais time que a Argentina por que venceu um jogo?,Capone__x brunoformiga Zebras acontecem Futebol é isso Nem sempre melhor ganha A Suíça é melhor que França por que venceu um jogo O oriente médio é mais time que Argentina por que venceu um jogo
907,"Al parecer Jexx Da Pus no sobrevivió al 2-0 contra Argentina, me encuentro devastado https://t.co/xCZ6ESMB9r",Al parecer Jexx Da Pus sobrevivió al contra Argentina encuentro devastado tco xCZ ESMB r
908,LO MÁS TIERNO QUE VAS A VER HOY😍 Un nene de dos años se volvió viral tras aprenderse los nombres de todos los jugadores de la Selección Argentina. https://t.co/lg4C8C2fda,LO MÁS TIERNO QUE VAS A VER HOY Un nene de dos años se volvió viral tras aprenderse los nombres de todos los jugadores de la Selección Argentina tco lg C C fda
909,@updatecharts e a argentina?,updatecharts e argentina
910,"@arturiano33 Deja de llorar mexicanos, unas vez más argentina demostró ser el mejor.",arturiano Deja de llorar mexicanos unas vez más argentina demostró ser el mejor
911,@juanci_2003 @I_Am_BillyKanne @Brisa75548367 @AnthonyyFCB @Canelo Porque en Argentina o viajas o vives,juanci _ I_Am_BillyKanne Brisa AnthonyyFCB Canelo Porque en Argentina viajas vives
912,@CarlosHenriqueV @luckydementa @BrunoFerreeiraz @nocontextfooty Que feo perder la final en el Maracana contra argentina kkkkkk,CarlosHenriqueV luckydementa BrunoFerreeiraz nocontextfooty Que feo perder la final en el Maracana contra argentina kkkkkk
913,@Maco_chee @jorgeanaini @HctorSalinas8 @cesc4official Habían hinchas mexicanos hasta quemando la bandera de Alemania y muchos que le hicieron lo mismo a la de Argentina,Maco_chee jorgeanaini HctorSalinas cesc official Habían hinchas mexicanos hasta quemando la bandera de Alemania muchos que le hicieron lo mismo la de Argentina
914,@bbva_argentina Hola! Les mandé una consulta por dm. Gracias!,bbva_argentina Hola Les mandé una consulta por dm Gracias
915,"Los de Bangladesh son fanáticos de Argentina porque no hablan español, así de simple. Si entendieran a esos mamadores sabrían porque la mayoría de Latinoamerica festeja cuando pierden.",Los de Bangladesh son fanáticos de Argentina porque hablan español así de simple Si entendieran esos mamadores sabrían porque la mayoría de Latinoamerica festeja cuando pierden
916,"@LANACION La korrupción no permite ni siquiera defender los árboles y el agua. Somos un país de ignorantes ambientales. Lo peor, que lo sufrimos y lo sufrirán nuestros hijos y nietos, como todo en Argentina. Las grandes potencias, se van a quedar con todos nuestros recursos",LANACION La korrupción permite ni siquiera defender los árboles el agua Somos un país de ignorantes ambientales Lo peor que lo sufrimos lo sufrirán nuestros hijos nietos como todo en Argentina Las grandes potencias se van quedar con todos nuestros recursos
917,"Por mi, que se vaya a chingar a su padre messi, el canelo, el mundial, la bandera, la playera, la selección, argentina, catar, amlo y lili Téllez juntos, agarrados de las manos y en bicicleta para que lleguen más rápido",Por mi que se vaya chingar su padre messi el canelo el mundial la bandera la playera la selección argentina catar amlo lili Téllez juntos agarrados de las manos en bicicleta para que lleguen más rápido
918,"la rivalidad entre Mexico y Argentina es inexistente, ellos quieren estar a nuestra altura pero no pueden. 
Los Rivales de Argentina:
⭐⭐⭐⭐⭐Brasil
⭐⭐⭐⭐Alemania
⭐⭐Uruguay
⭐Inglaterra
Chile 
Esas son algunas rivalidades de la albiceleste. Los buenos van con los buenos",la rivalidad entre Mexico Argentina es inexistente ellos quieren estar nuestra altura pero pueden Los Rivales de Argentina Brasil Alemania Uruguay InglaterraChile Esas son algunas rivalidades de la albiceleste Los buenos van con los buenos
919,@Martinpdisalvo Preocúpate por Argentina porque hasta Japón puede llegar a dejar afuera a Argentina,Martinpdisalvo Preocúpate por Argentina porque hasta Japón puede llegar dejar afuera Argentina
920,"@tariqpanja India is nowhere in football so my 1st memory of football is the 86 WC &amp; I supported West Germany (loved Becker). 
Traveled 15 miles to an uncle's house to watch the finals &amp; have hated Argentina ever since. It was only last year that I finally got over it for Messi &amp; Copa finals",tariqpanja India nowhere football st memory football WC amp I supported West Germany loved Becker Traveled miles uncle house watch finals amp hated Argentina ever since It last year I finally got Messi amp Copa finals
921,@vdeviados PRINCIPALMENTE QUANDO EH PRA ARGENTINA  VSF,vdeviados PRINCIPALMENTE QUANDO EH PRA ARGENTINA VSF
922,@dr_A26 And we  destroyed Argentina 🙏 hopefully we can make it,dr_A And destroyed Argentina hopefully make
923,"Bueno, parece que Bangladesh se divide entre hinchas de Argentina y Brasil como Quitilipi entre River y Boca.
Y existe este buen hombre con intenciones de integrar las dos pasiones... https://t.co/MXMrykTKVm",Bueno parece que Bangladesh se divide entre hinchas de Argentina Brasil como Quitilipi entre River BocaY existe este buen hombre con intenciones de integrar las dos pasiones tco MXMrykTKVm
924,"@ManyaYo5yvos @discrepo__ Imbécil consumimos todo el día argentina y encima nos dan de comer en verano, cerra el orto",ManyaYo yvos discrepo __ Imbécil consumimos todo el día argentina encima nos dan de comer en verano cerra el orto
925,"📰 Adds that OPEC+ would need to cut output to balance out supply growth from places such as Brazil, Norway, Guyana, U.S., Canada and Argentina next year https://t.co/Kn7pGHnDGK https://t.co/XD7RWFaZ6T #news #retweet",Adds OPEC would need cut output balance supply growth places Brazil Norway Guyana US Canada Argentina next year tco Kn pGHnDGK tco XD RWFaZ T news retweet
926,y mi nariz argentina de la que estoy orgulloso? https://t.co/zmb5bvIyDf,mi nariz argentina de la que estoy orgulloso tco zmb bvIyDf
927,a ver si los que dicen que argentina no es américa latina se devuelven a su país y dejan de estudiar y recibir atención de salud gratis acá 💋,ver si los que dicen que argentina es américa latina se devuelven su país dejan de estudiar recibir atención de salud gratis acá
928,"@ajzervin10 @Canelo El boxeo es de los deportes más feo del mundo. Solo una sociedad alcohólica, drogadicta y violenta lo puede defender. En argentina nos chupa un huevo el boxeo. Deporte de idiotas. Aparte, cómo si canelo fuera tan bueno, haces una encuesta y no lo conoce nadie.",ajzervin Canelo El boxeo es de los deportes más feo del mundo Solo una sociedad alcohólica drogadicta violenta lo puede defender En argentina nos chupa un huevo el boxeo Deporte de idiotas Aparte cómo si canelo fuera tan bueno haces una encuesta lo conoce nadie
929,@dnrabgod @TorresErwerle Eso estaría excelente. @afa @Argentina sería el mejor gesto,dnrabgod TorresErwerle Eso estaría excelente afa Argentina sería el mejor gesto
930,"@omarcj11 Si es lo que no me gustaba que no definía bien, pero tiene buena sancada, mete el cuerpo y se mete bien entre los centrales, tiene juego aéreo, justo lo que se necesitaba vs Argentina",omarcj Si es lo que gustaba que definía bien pero tiene buena sancada mete el cuerpo se mete bien entre los centrales tiene juego aéreo justo lo que se necesitaba vs Argentina
931,@Gabmatheusss @JR_Trocoli Argentina KKKKKKKKK tá acompanhando a Copa?,Gabmatheusss JR_Trocoli Argentina KKKKKKKKK tá acompanhando Copa
932,"@humildemente21 @Javierito321 La selección de mayores que ha sacado la cara en la historia del deporte venezolano siempre ha sido la de baloncesto y nunca ha sido publicitada, de hecho es la última campeona del continente, ganándole a Canadá con 11 nba y a Argentina que siempre ha sido potencia",humildemente Javierito La selección de mayores que ha sacado la cara en la historia del deporte venezolano siempre ha sido la de baloncesto nunca ha sido publicitada de hecho es la última campeona del continente ganándole Canadá con nba Argentina que siempre ha sido potencia
933,"Mail del jardín,aumento de $2 Lucas!hermoso comienzo de semana! Vamos vamos argentina 😂😂😂",Mail del jardínaumento de Lucas hermoso comienzo de semana Vamos vamos argentina
934,@FIFAcom @Argentina We love Argentina 🇦🇷 🇧🇩✌️,FIFAcom Argentina We love Argentina
935,"Acaba de publicar una foto en Buenos Aires, Argentina https://t.co/ngGLbxuhLt",Acaba de publicar una foto en Buenos Aires Argentina tco ngGLbxuhLt
936,@AustinBurga @AlberrtoRM Entonces Argentina y España si lo son? Kakakkkakakkka,AustinBurga AlberrtoRM Entonces Argentina España si lo son Kakakkkakakkka
937,"Copa do mundo não tem jogo fácil, tanto que arabia saudita ganhou da argentina, frança suou pra ganhar da dinamarca, alemanha perdeu pro Japão, belgica pegou porrada do marrocos

Copa é diferente https://t.co/oN98xpUewO",Copa mundo não tem jogo fácil tanto que arabia saudita ganhou da argentina frança suou pra ganhar da dinamarca alemanha perdeu pro Japão belgica pegou porrada marrocosCopa é diferente tco oN xpUewO
938,Massalin Particulares es la primera empresa en Argentina en lograr la certificación AWS https://t.co/ItRYihpriX,Massalin Particulares es la primera empresa en Argentina en lograr la certificación AWS tco ItRYihpriX
939,@SmashuFlashu @pacocapo22 fácilmente mi foto favorita de smash argentina,SmashuFlashu pacocapo fácilmente mi foto favorita de smash argentina
940,"Sebastian de Urquiza is a Bostonian by birth and grew up in Argentina. He graduated from the National University of Arts with a degree in double bass🎶

https://t.co/RBniXZ8m6M

#musician #music #bass https://t.co/elCZ4lrOlr",Sebastian de Urquiza Bostonian birth grew Argentina He graduated National University Arts degree double bass tco RBniXZ M musician music bass tco elCZ lrOlr
941,@updatecharts a surra na Argentina uc,updatecharts surra na Argentina uc
942,@vickyfloydd @IRemaek @ElBuenChico_ Argentina presiona para congelar precios: La crisis económica que vive e... https://t.co/0JuXtDkVv3 vía @YouTube Otro ejemplo 😂,vickyfloydd IRemaek ElBuenChico _ Argentina presiona para congelar precios La crisis económica que vive e tco JuXtDkVv vía YouTube Otro ejemplo
943,"O PIB da argentina, suíça, sérvia e alemanha juntas #FIFAWorldCup https://t.co/hXZVKY4tUC",O PIB da argentina suíça sérvia e alemanha juntas FIFAWorldCup tco hXZVKY tUC
944,@updatecharts @lorranyzxx tua mulher torce pra Argentina😡😡😡😡😡,updatecharts lorranyzxx tua mulher torce pra Argentina
945,@Tim_Vickery Anyone else looking forward to hearing Tim and co on the world football phone in later? Particularly with Argentina and Brazil doing so well.,Tim_Vickery Anyone else looking forward hearing Tim co world football phone later Particularly Argentina Brazil well
946,¿Qué necesita Argentina para pasar a octavos? ¿Qué posibles rivales tiene? https://t.co/Y0Woy4IMD1 vía @CNNEE,Qué necesita Argentina para pasar octavos Qué posibles rivales tiene tco Y Woy IMD vía CNNEE
947,".
¡Gracias Señor!
.
#Noviembre #Seguridad #Versículos #Biblia #Dios #Versículodeldía #PalabradeDios #sociedadesbíblicasunidas #SBU #SBA #sociedadbíblicaargentina #Argentina #sociedadbíblica https://t.co/aciPKZnW3e",Gracias Señor Noviembre Seguridad Versículos Biblia Dios Versículodeldía PalabradeDios sociedadesbíblicasunidas SBU SBA sociedadbíblicaargentina Argentina sociedadbíblica tco aciPKZnW e
948,"@tony_ninix @updatecharts No caso, a Argentina é o blackpink do futebol https://t.co/VBq6zmvJyd",tony_ninix updatecharts No caso Argentina é blackpink futebol tco VBq zmvJyd
949,@JoaoBrrz @dimartinno3 @nocontextfooty Kkkkkk poxa eu cago coisa melhor q Argentina kkkkk,JoaoBrrz dimartinno nocontextfooty Kkkkkk poxa eu cago coisa melhor q Argentina kkkkk
950,"@KoutaPhantom @Kozoovo @Canelo A vos te parece gracioso y cosa para pasar el rato reírse de lo q paso en las Malvinas? Las muertes de jóvenes q defendieron a nuestra patria? Eso es para pasar el rato? Q mal q estas de la cabeza eh, ustedes no se merecen ni respeto y menos de argentina.",KoutaPhantom Kozoovo Canelo A vos te parece gracioso cosa para pasar el rato reírse de lo q paso en las Malvinas Las muertes de jóvenes q defendieron nuestra patria Eso es para pasar el rato Q mal q estas de la cabeza eh ustedes se merecen ni respeto menos de argentina
951,@ESPNArgentina PRÓXIMO ÉS ARGENTINA RACISTA DE MIERDA,ESPNArgentina PRÓXIMO ÉS ARGENTINA RACISTA DE MIERDA
952,@gartuz @DeAlajuelaObvio https://t.co/g3liCV6tbX,gartuz DeAlajuelaObvio tco g liCV tbX
953,"@theweeknd bebe, venis a Argentina. Estoy que me muero!!!",theweeknd bebe venis Argentina Estoy que muero
954,"FERCHO | The Shield - Amoroso
Ya está disponible en @YouTube @youtubemusic, escúchalo ahora.
#Amoroso #ferchoproductor #producer #producerlife #NewMusic #NewMusicAlert #NewMusicRelease #NewMusicMonday #music #pop #Cumbia #beatmaker #producer #love #viral #Venezuela #Argentina https://t.co/PjKQmvafDa",FERCHO The Shield AmorosoYa está disponible en YouTube youtubemusic escúchalo ahora Amoroso ferchoproductor producer producerlife NewMusic NewMusicAlert NewMusicRelease NewMusicMonday music pop Cumbia beatmaker producer love viral Venezuela Argentina tco PjKQmvafDa
955,@iam_brau @TeacherOfBall is France not better than both Argentina &amp; Brazil combined? 🙄,iam_brau TeacherOfBall France better Argentina amp Brazil combined
956,"@kunfantaforo Paises Bajos vs Qatar 3 a 0
Ecuador vs Senegal 2 a 1
Gales vs Inglaterra 0 a 4
Irán vs Estados Unidos 0 a 1
Tunez vs Francia 0 a 2
Australia vs Dinamarca 1 a 1
Polonia vs Argentina 0 a 1
Arabia Saudita vs Mexico 1 a 2",kunfantaforo Paises Bajos vs Qatar Ecuador vs Senegal Gales vs Inglaterra Irán vs Estados Unidos Tunez vs Francia Australia vs Dinamarca Polonia vs Argentina Arabia Saudita vs Mexico
957,"@mkfadii Not Belgium 😂
Ok but seriously though while I had Argentina winning to start (and I still think that will happen), Spain are clearly playing the best football out of anyone so far in my view.",mkfadii Not Belgium Ok seriously though I Argentina winning start I still think happen Spain clearly playing best football anyone far view
958,the weeknd va a estar en la Argentina y dios me dio dos riñones para esta situación,weeknd va estar en la Argentina dios dio dos riñones para esta situación
959,@Tatiiperezz__ @LauriaProd @LauriaProd dale lauria porque si no gana eso y pierde argentina nos pega un tiró a nosotras,Tatiiperezz __ LauriaProd LauriaProd dale lauria porque si gana eso pierde argentina nos pega un tiró nosotras
960,¿Cómo llega Argentina al partido contra Polonia? El análisis de Juan Pablo Varsky https://t.co/jcwSbvim1Q,Cómo llega Argentina al partido contra Polonia El análisis de Juan Pablo Varsky tco jcwSbvim Q
961,@camilanaocabell Argentina kkkkk,camilanaocabell Argentina kkkkk
962,"@scary_biscuits @AlisonMaryORE OK. I came to Ireland from Argentina, where corruption and crime are rife.
Can I have a house, and preferably a new car too?",scary_biscuits AlisonMaryORE OK I came Ireland Argentina corruption crime rifeCan I house preferably new car
963,"La inflación afecta actualmente al mundo entero, es el caso de 𝑨𝒓𝒈𝒆𝒏𝒕𝒊𝒏𝒂, en donde ya se habla de hiperinflación, pues según las previsiones para diciembre, la inflación se aproximan al 100%. 

https://t.co/fQ6x9TDdgI",La inflación afecta actualmente al mundo entero es el caso de 𝑨𝒓𝒈𝒆𝒏𝒕𝒊𝒏𝒂 en donde ya se habla de hiperinflación pues según las previsiones para diciembre la inflación se aproximan al tco fQ x TDdgI
964,"@vdm0206 @RafaelbsvBH @nocontextfooty Ok, tambem acho que errou com Fred, mas se for pensar assim, Argentina ta sofrendo no grupo dela, Alemanha também, e a Espanha empatou com a Alemanha, a França se não fosse o Mbappe tinha peidado pra Dinamarca.
Não tem essa de ""se pegar uma seleção forte toma taca"". Isso é copa",vdm RafaelbsvBH nocontextfooty Ok tambem acho que errou com Fred mas se pensar assim Argentina ta sofrendo grupo dela Alemanha também e Espanha empatou com Alemanha França se não fosse Mbappe tinha peidado pra DinamarcaNão tem essa de se pegar uma seleção forte toma taca Isso é copa
965,"No hay que dejar pasar una
Cuánto se está pareciendo Uruguay
A la tan cercana y tan lejana Argentina
Como México USA
Tan lejos de Dios y tan cerca de USA https://t.co/ArlHWqqWBd",No hay que dejar pasar unaCuánto se está pareciendo UruguayA la tan cercana tan lejana ArgentinaComo México USATan lejos de Dios tan cerca de USA tco ArlHWqqWBd
966,"*cualquier jugador d Argentina haciendo dos pasos*
Toto: viven en un country...",cualquier jugador Argentina haciendo dos pasos Toto viven en un country
967,@jessiexstm No sabes dónde queda argentina y querés hablar de nazis que idiota mental claro en tu país seguro no hay nazis jajaja se nota que tu cabeza no conectan dos neuronas,jessiexstm No sabes dónde queda argentina querés hablar de nazis que idiota mental claro en tu país seguro hay nazis jajaja se nota que tu cabeza conectan dos neuronas
968,"@tariqpanja India is nowhere in football so my 1st memory of football is the 86 WC &amp; I supported West Germany (loved Becker). 
Traveled 15 miles to an uncle's house to watch the finals &amp; have hated Argentina ever since. It was only last year that I finally got over it for Messi &amp; Copa finals",tariqpanja India nowhere football st memory football WC amp I supported West Germany loved Becker Traveled miles uncle house watch finals amp hated Argentina ever since It last year I finally got Messi amp Copa finals
969,@vdeviados PRINCIPALMENTE QUANDO EH PRA ARGENTINA  VSF,vdeviados PRINCIPALMENTE QUANDO EH PRA ARGENTINA VSF
