,tweet,clean_tweet
466,@carlosakd53 Igual en Argentina la habrá pasado mil veces mejor que en Marruecos. Que siempre fue muy complejo. Aunque uno normalmente añora la juventud y debe venir por ese lado la cosa.,carlosakd Igual en Argentina la habrá pasado mil veces mejor que en Marruecos Que siempre fue muy complejo Aunque uno normalmente añora la juventud debe venir por ese lado la cosa
467,Super crazy 💥💥 #LeoMessi #Argentina https://t.co/TmpiTqb0Cs,Super crazy LeoMessi Argentina tco TmpiTqb Cs
468,@_vitorhgon @oocbrsao Argentina é melhor que portugal,_vitorhgon oocbrsao Argentina é melhor que portugal
469,Irán: Raisi nombró como parte de su gabinete al responsable del atentado a la AMIA en Argentina https://t.co/RahevUqKQC,Irán Raisi nombró como parte de su gabinete al responsable del atentado la AMIA en Argentina tco RahevUqKQC
470,Canelo: pedile a Dios que Argentina no tenga misiles intercontinentales. Pero tenemos pibes con mucha pólvora! Tus puños te van a servir solo para agarrar el papel higiénico!,Canelo pedile Dios que Argentina tenga misiles intercontinentales Pero tenemos pibes con mucha pólvora Tus puños te van servir solo para agarrar el papel higiénico
471,"@Bosnjakkk1 @Croxley_Gooner @FIFAcom @Argentina U say smth tht u have no idea about. Change ur glasses, not eyes. U ll see better",Bosnjakkk Croxley_Gooner FIFAcom Argentina U say smth tht u idea Change ur glasses eyes U see better
472,@aledani04 @EddyWRX32 @don_stone1 Más feo es tener que venirse de argentina a mexico para poder vivir bien….,aledani EddyWRX don_stone Más feo es tener que venirse de argentina mexico para poder vivir bien
473,@khj_heneciatwt Siempre te apoyaré mi niño nunca te soltare de tu mano eres un ser humano maravilloso y un artista espectacular te saludo desde argentina,khj_heneciatwt Siempre te apoyaré mi niño nunca te soltare de tu mano eres un ser humano maravilloso un artista espectacular te saludo desde argentina
474,"Yo lo siento pero no, porque tiene mucho más nivel serbia que Arabia Saudí, por ejemplo y con todo el respeto no aguantaría otro México Argentina por que salvo los 2 goles fue un muermo https://t.co/JM4wF25zAp",Yo lo siento pero porque tiene mucho más nivel serbia que Arabia Saudí por ejemplo con todo el respeto aguantaría otro México Argentina por que salvo los goles fue un muermo tco JM wF zAp
475,"esta gringa mogolica le preguntás por George Floyd y te manda a preguntarle a la policía, pero es culpa de todo un Argentina lo que hacían los oligarcas militares hace *150 AÑOS* https://t.co/iAsNAjgTVj",esta gringa mogolica le preguntás por George Floyd te manda preguntarle la policía pero es culpa de todo un Argentina lo que hacían los oligarcas militares hace AÑOS tco iAsNAjgTVj
476,"@tiki__________ @Yuuu_Kcherry Entonces vayan a dinamarca, estudien, desarrollen un nivel de inglés avanzado y estudien, pero no, vienen para acá porque argentina los recibe sin problemas ni papeles, mal agradecidos de mierda",tiki ___ Yuuu_Kcherry Entonces vayan dinamarca estudien desarrollen un nivel de inglés avanzado estudien pero vienen para acá porque argentina los recibe sin problemas ni papeles mal agradecidos de mierda
477,@Tenhagya___ Me joderia muchísimo ir con los panchos de argentina eh,Tenhagya ___ Me joderia muchísimo ir con los panchos de argentina eh
478,"🔥⚽️Los pibes de River que le cambiaron la cara a la Argentina ante México

¿Crees que tienen que ser titulares ante Polonia? Te leemos 👇👇 https://t.co/rHlTSZcSvd",Los pibes de River que le cambiaron la cara la Argentina ante México Crees que tienen que ser titulares ante Polonia Te leemos tco rHlTSZcSvd
479,@updatecharts e a argentina?,updatecharts e argentina
480,@ElPulsoAlaUna Argentina será finalistas de catar y campeón,ElPulsoAlaUna Argentina será finalistas de catar campeón
481,mais copa q a argentina em uma foto https://t.co/1zmS9PGIYc,mais copa q argentina em uma foto tco zmS PGIYc
482,SerieB TV PLAY | Annuncio in diretta: tutto su Argentina e Brasile https://t.co/ln0pqG2GJ6 #Notizie #PrimoPiano https://t.co/nbRfkmouJz,SerieB TV PLAY Annuncio diretta tutto su Argentina e Brasile tco ln pqG GJ Notizie PrimoPiano tco nbRfkmouJz
483,"@FinoYossen @Argentina Lo de dársela a un compañero no importa, total pidió la pelota 157 veces 😂",FinoYossen Argentina Lo de dársela un compañero importa total pidió la pelota veces
484,"@Chanklismo Mentira, el de Argentina de mañana también lo echan en la 1",Chanklismo Mentira el de Argentina de mañana también lo echan en la
485,#Argentina El Gobierno argentino notificó el pasado viernes la reapertura del “dólar soja” con la intención de promocionar las exportaciones del sector agroindustrial y fortalecer las reservas. Ver más en https://t.co/vHJ9NEOVtM,Argentina El Gobierno argentino notificó el pasado viernes la reapertura del dólar soja con la intención de promocionar las exportaciones del sector agroindustrial fortalecer las reservas Ver más en tco vHJ NEOVtM
486,"@AkaEmmaYS @Bloomers6735 @piperdmsss @JadhKal @tucallister @jacemix @bjs_alejo2 @Canelo Pero JAJSNSJS que mexico tenga más gente no justifica que su % sea mas alto, justamente el PORCENTAJE se saca para saber que país tiene MENOS POBREZA y vos mismo decís que es argentina

Sino como MIERDA se mide que país tiene menos pobreza según su gente",AkaEmmaYS Bloomers piperdmsss JadhKal tucallister jacemix bjs_alejo Canelo Pero JAJSNSJS que mexico tenga más gente justifica que su sea mas alto justamente el PORCENTAJE se saca para saber que país tiene MENOS POBREZA vos mismo decís que es argentinaSino como MIERDA se mide que país tiene menos pobreza según su gente
487,"@Moritablue2 @pi_yata @noterikcastro @Canelo Reviente , reviente jajajajaj no sabes ya q decirme , siga disfrutando de los goles de Argentina , nos vemos chapulin 🤣🤣🤣🤣",Moritablue pi_yata noterikcastro Canelo Reviente reviente jajajajaj sabes ya q decirme siga disfrutando de los goles de Argentina nos vemos chapulin
488,"@kaiforia 19, argentina, soft, versátil pero mas bottomero, bi, yo😋",kaiforia argentina soft versátil pero mas bottomero bi yo
489,"@eelknightwing @DIEGO_ETERN0 @tendenciasposta Mexicano? Jajajaj deja de festejar cosas ajenas, aunque bueno viendo como esta tu selección y que hace mas de 15 años no le ganas Argentina es normal que festejes cualquier cosa jajaja",eelknightwing DIEGO_ETERN tendenciasposta Mexicano Jajajaj deja de festejar cosas ajenas aunque bueno viendo como esta tu selección que hace mas de años le ganas Argentina es normal que festejes cualquier cosa jajaja
490,"@gblrtr @neia29Rc @iampauloandre Neymar ganhou de seleção forte ?? Kkkk até o Messi ja levou a seleção ruim da Argentina em uma final , o que Neymar fez pela seleção ??",gblrtr neia Rc iampauloandre Neymar ganhou de seleção forte Kkkk até Messi ja levou seleção ruim da Argentina em uma final que Neymar fez pela seleção
491,"@Sleeptogrow @ANG3LH0LIC Argentina depende socialmente del fútbol, el chavó es lo que menos se busca de Mexico 💀",Sleeptogrow ANG LH LIC Argentina depende socialmente del fútbol el chavó es lo que menos se busca de Mexico
492,@Canelo Lógico da coraje ver eso si fue o no verdad primero que nada que hacía la camisa de la selección Mexicana en el vestidor de Argentina? Y tirada en el puto suelo?? No somos pendejos señores ...pero no solo el @Canelo por ser figura pública lo quiere ver como el malo de la historia,Canelo Lógico da coraje ver eso si fue verdad primero que nada que hacía la camisa de la selección Mexicana en el vestidor de Argentina Y tirada en el puto suelo No somos pendejos señores pero solo el Canelo por ser figura pública lo quiere ver como el malo de la historia
493,"@fakazzzzz Pero Pancho joder como se nota que la educación flaquea por Argentina🇦🇷🇦🇷🇦🇷 estaba hablando de baloncesto joder, espabila burra",fakazzzzz Pero Pancho joder como se nota que la educación flaquea por Argentina estaba hablando de baloncesto joder espabila burra
494,"@LucDeverauxMty @contylyl @LuchoIbarra690 Están festejando porque no fueron eliminados del mundial, payaso. 
Si México ganara tambien festejarían como si fuera la copa porque para ellos derrotar a argentina seria un sueño.",LucDeverauxMty contylyl LuchoIbarra Están festejando porque fueron eliminados del mundial payaso Si México ganara tambien festejarían como si fuera la copa porque para ellos derrotar argentina seria un sueño
495,"“Haciendo pie”, con Jorge Sigal y Santiago Kovadloff - 27/11/22 https://t.co/2jd2ZefbI8 #CorrupcionOJusticia Pobreza #Dólar #BuenLunes Messi Argentina Enzo Bangladesh Baradel Malvinas La Plata",Haciendo pie con Jorge Sigal Santiago Kovadloff tco jd ZefbI CorrupcionOJusticia Pobreza Dólar BuenLunes Messi Argentina Enzo Bangladesh Baradel Malvinas La Plata
496,"Torcer pra Argentina: 🤬🤬😡
Torcer pra Portugal: 🥰🥰😍

Não torço nenhum dos dois, mas acho que quem torce pra Portugal, e enche o saco de quem torce pra argentina é hipócrita, só a minha opinião importa.",Torcer pra Argentina Torcer pra Portugal Não torço nenhum dos dois mas acho que quem torce pra Portugal e enche saco de quem torce pra argentina é hipócrita só minha opinião importa
497,@Canelo A parte para que intercambian camisetas? Quisiera ver que hicieron con la de Argentina  en el vestuario de México...,Canelo A parte para que intercambian camisetas Quisiera ver que hicieron con la de Argentina en el vestuario de México
498,"The Weekend viene el año que viene a la Argentina....BASTA LOCO, NO PUEDO VERLA A LALI QUE ES ARTISTA NACIONAL Y VOS ME TRAES MÁS AÚN, LPM 😤 
#HartoDeSerPobre",The Weekend viene el año que viene la ArgentinaBASTA LOCO NO PUEDO VERLA A LALI QUE ES ARTISTA NACIONAL Y VOS ME TRAES MÁS AÚN LPM HartoDeSerPobre
499,"@gracielaocana Bola de grasa,vos denunciás?.Tenés deudas con la patria,el pueblo y la historia argentina,sos un ser inmundo,no sabés el asco que provocás con solo verte,sucia impresentable.",gracielaocana Bola de grasavos denunciás Tenés deudas con la patriael pueblo la historia argentinasos un ser inmundono sabés el asco que provocás con solo vertesucia impresentable
500,Italo Sena na Argentina é a cura da depressão,Italo Sena na Argentina é cura da depressão
501,"@CyberVirgem @jeongukkinie @tiadasarmy Vai realmente tentar fingir que isso não existe em TODA comunidade?? Esses dias mesmo tinha torcedor da Argentina falando que era pra escravidão voltar, quase 40k de likes, chuva de racismo e homofobia",CyberVirgem jeongukkinie tiadasarmy Vai realmente tentar fingir que isso não existe em TODA comunidade Esses dias mesmo tinha torcedor da Argentina falando que era pra escravidão voltar quase k de likes chuva de racismo e homofobia
502,"@_catascorti @Alvarez2690 @CaroZaraate @bjs_alejo2 Canelo me pela la verga, igual que maradroga de mierda por mi pueden ir todos a chingar a su puta madre, yo saco al gordo pedofilo porque veo acá mucho doblemoral, de igual forma canelo con el 10% de su salario compra argentina",_catascorti Alvarez CaroZaraate bjs_alejo Canelo pela la verga igual que maradroga de mierda por mi pueden ir todos chingar su puta madre yo saco al gordo pedofilo porque veo acá mucho doblemoral de igual forma canelo con el de su salario compra argentina
503,@messiesios @migquintana Siento lastimarte pero Argentina también está siendo horrible,messiesios migquintana Siento lastimarte pero Argentina también está siendo horrible
504,"@l3nchurey Primero y principal,que Argentina les mandaba barcos con cargamento de comida en la década del 40 para paliar la hambruna impuesta por la corona británica,y encima estos hijos de putas se los confiscaba.",l nchurey Primero principalque Argentina les mandaba barcos con cargamento de comida en la década del para paliar la hambruna impuesta por la corona británicay encima estos hijos de putas se los confiscaba
505,"@tlo_thiag0 Sim pela soberba igual a Argentina perdeu pra Arábia e a França quase perdeu pra Argentina em 2018 

Acham que tá ganho o jogo e tomam gol de bobeira",tlo_thiag Sim pela soberba igual Argentina perdeu pra Arábia e França quase perdeu pra Argentina em Acham que tá ganho jogo e tomam gol de bobeira
506,No friegues Schwartz!!!! Se ve algúna camisa de Argentina en el suelo!!! Has de ser su lamebotas!!!! https://t.co/9gch5khFlo,No friegues Schwartz Se algúna camisa de Argentina en el suelo Has de ser su lamebotas tco gch khFlo
507,@sunushae o haechan nunca torceria pra argentina pq ele tem bom gosto #minhaopiniao,sunushae haechan nunca torceria pra argentina pq ele tem bom gosto minhaopiniao
508,@carlosakd53 Igual en Argentina la habrá pasado mil veces mejor que en Marruecos. Que siempre fue muy complejo. Aunque uno normalmente añora la juventud y debe venir por ese lado la cosa.,carlosakd Igual en Argentina la habrá pasado mil veces mejor que en Marruecos Que siempre fue muy complejo Aunque uno normalmente añora la juventud debe venir por ese lado la cosa
509,Super crazy 💥💥 #LeoMessi #Argentina https://t.co/TmpiTqb0Cs,Super crazy LeoMessi Argentina tco TmpiTqb Cs
510,@_vitorhgon @oocbrsao Argentina é melhor que portugal,_vitorhgon oocbrsao Argentina é melhor que portugal
511,Irán: Raisi nombró como parte de su gabinete al responsable del atentado a la AMIA en Argentina https://t.co/RahevUqKQC,Irán Raisi nombró como parte de su gabinete al responsable del atentado la AMIA en Argentina tco RahevUqKQC
512,Canelo: pedile a Dios que Argentina no tenga misiles intercontinentales. Pero tenemos pibes con mucha pólvora! Tus puños te van a servir solo para agarrar el papel higiénico!,Canelo pedile Dios que Argentina tenga misiles intercontinentales Pero tenemos pibes con mucha pólvora Tus puños te van servir solo para agarrar el papel higiénico
513,"@Bosnjakkk1 @Croxley_Gooner @FIFAcom @Argentina U say smth tht u have no idea about. Change ur glasses, not eyes. U ll see better",Bosnjakkk Croxley_Gooner FIFAcom Argentina U say smth tht u idea Change ur glasses eyes U see better
514,@aledani04 @EddyWRX32 @don_stone1 Más feo es tener que venirse de argentina a mexico para poder vivir bien….,aledani EddyWRX don_stone Más feo es tener que venirse de argentina mexico para poder vivir bien
515,@khj_heneciatwt Siempre te apoyaré mi niño nunca te soltare de tu mano eres un ser humano maravilloso y un artista espectacular te saludo desde argentina,khj_heneciatwt Siempre te apoyaré mi niño nunca te soltare de tu mano eres un ser humano maravilloso un artista espectacular te saludo desde argentina
516,"Yo lo siento pero no, porque tiene mucho más nivel serbia que Arabia Saudí, por ejemplo y con todo el respeto no aguantaría otro México Argentina por que salvo los 2 goles fue un muermo https://t.co/JM4wF25zAp",Yo lo siento pero porque tiene mucho más nivel serbia que Arabia Saudí por ejemplo con todo el respeto aguantaría otro México Argentina por que salvo los goles fue un muermo tco JM wF zAp
517,"esta gringa mogolica le preguntás por George Floyd y te manda a preguntarle a la policía, pero es culpa de todo un Argentina lo que hacían los oligarcas militares hace *150 AÑOS* https://t.co/iAsNAjgTVj",esta gringa mogolica le preguntás por George Floyd te manda preguntarle la policía pero es culpa de todo un Argentina lo que hacían los oligarcas militares hace AÑOS tco iAsNAjgTVj
518,"@tiki__________ @Yuuu_Kcherry Entonces vayan a dinamarca, estudien, desarrollen un nivel de inglés avanzado y estudien, pero no, vienen para acá porque argentina los recibe sin problemas ni papeles, mal agradecidos de mierda",tiki ___ Yuuu_Kcherry Entonces vayan dinamarca estudien desarrollen un nivel de inglés avanzado estudien pero vienen para acá porque argentina los recibe sin problemas ni papeles mal agradecidos de mierda
519,@Tenhagya___ Me joderia muchísimo ir con los panchos de argentina eh,Tenhagya ___ Me joderia muchísimo ir con los panchos de argentina eh
520,"🔥⚽️Los pibes de River que le cambiaron la cara a la Argentina ante México

¿Crees que tienen que ser titulares ante Polonia? Te leemos 👇👇 https://t.co/rHlTSZcSvd",Los pibes de River que le cambiaron la cara la Argentina ante México Crees que tienen que ser titulares ante Polonia Te leemos tco rHlTSZcSvd
521,@updatecharts e a argentina?,updatecharts e argentina
522,@ElPulsoAlaUna Argentina será finalistas de catar y campeón,ElPulsoAlaUna Argentina será finalistas de catar campeón
523,mais copa q a argentina em uma foto https://t.co/1zmS9PGIYc,mais copa q argentina em uma foto tco zmS PGIYc
524,SerieB TV PLAY | Annuncio in diretta: tutto su Argentina e Brasile https://t.co/ln0pqG2GJ6 #Notizie #PrimoPiano https://t.co/nbRfkmouJz,SerieB TV PLAY Annuncio diretta tutto su Argentina e Brasile tco ln pqG GJ Notizie PrimoPiano tco nbRfkmouJz
525,"A los argentinos se les está olvidando que su selección juega basura, argentina no tiene nada que hacer contra Francia, España o Brasil, incluso Inglaterra, países bajos o Portugal sin problemas les pueden dar un susto.",A los argentinos se les está olvidando que su selección juega basura argentina tiene nada que hacer contra Francia España Brasil incluso Inglaterra países bajos Portugal sin problemas les pueden dar un susto
526,"@BullyingFutbol ¿Quiere la selección de tarados arreglar esté pedo?, sólo se tiene que dejar ganar por Arabia en la última jornada de grupos y chance hasta regresen con un buen varo y Ferraris pará cada quien y así fastidiar a Martino y a toda Argentina, sí van a hacer el ridículo,que lo valga",BullyingFutbol Quiere la selección de tarados arreglar esté pedo sólo se tiene que dejar ganar por Arabia en la última jornada de grupos chance hasta regresen con un buen varo Ferraris pará cada quien así fastidiar Martino toda Argentina sí van hacer el ridículoque lo valga
527,@martinisport101 @PajaritoDeIvan De igual sigue siendo mejor que Argentina y el resto de Suramérica. Argentina de igual no está para campeonato.,martinisport PajaritoDeIvan De igual sigue siendo mejor que Argentina el resto de Suramérica Argentina de igual está para campeonato
528,Todavía se cree que esta persona representa el liberalismo en Argentina? https://t.co/Mfnpl8hgin,Todavía se cree que esta persona representa el liberalismo en Argentina tco Mfnpl hgin
529,@Argentina Love from Bangladesh🇧🇩,Argentina Love Bangladesh
530,“Scaloni reacciona y cambia”: las claves del triunfo de Argentina en FM latucumana https://t.co/QgAnxaoEqV,Scaloni reacciona cambia las claves del triunfo de Argentina en FM latucumana tco QgAnxaoEqV
531,"@_Dag_1 @chafa_keevin10 @mc_arrill @FinoYossen Saludos Nariz.

El Argentinito piensa que Argentina está mejor culturalmente que México.  Que ternura!! 

Bye 🤡",_Dag_ chafa_keevin mc_arrill FinoYossen Saludos NarizEl Argentinito piensa que Argentina está mejor culturalmente que México Que ternura Bye
532,@igoramondarain_ Brasil me gusta. Francia?! Tápate un poco que te paso la factura y saco capturas de tus comentarios con Argentina…,igoramondarain _ Brasil gusta Francia Tápate un poco que te paso la factura saco capturas de tus comentarios con Argentina
533,"Argentina campeon sudamericano de básquet femenino U15, entre ellas un orgullo del QUILMES ATLÉTICO CLUB
Martina Chober, felicitaciones gurisa!!!!
Disfruta este logro.
QUILMES, NO ES SOLO FÚTBOL https://t.co/uz9rJ2erjs",Argentina campeon sudamericano de básquet femenino U entre ellas un orgullo del QUILMES ATLÉTICO CLUBMartina Chober felicitaciones gurisa Disfruta este logroQUILMES NO ES SOLO FÚTBOL tco uz rJ erjs
534,"@Quiensabe987490 @df_lean @JoseMGaxiola1 @Faitelson_ESPN Un amistoso, ese es tu parametro? Ustedes se comieron 6-1 contra España, los amistosos que... Claro que los hay, tu equipo es bastante normalito, Messi, Dí Maria y poco más. insisto analizas con el orto, de México no se espera nada, pero con Argentina tampoco pasa nada ehh 😉",Quiensabe df_lean JoseMGaxiola Faitelson_ESPN Un amistoso ese es tu parametro Ustedes se comieron contra España los amistosos que Claro que los hay tu equipo es bastante normalito Messi Dí Maria poco más insisto analizas con el orto de México se espera nada pero con Argentina tampoco pasa nada ehh
535,"@marccrosas El tata entregó el partido VS argentina, la lógica era que EDSON marcara todo el partido a Messi y lo dejó en la banca",marccrosas El tata entregó el partido VS argentina la lógica era que EDSON marcara todo el partido Messi lo dejó en la banca
536,"@Canelo Tenés menos fútbol que la revista PARA TI... 
AGUANTE ARGENTINA.",Canelo Tenés menos fútbol que la revista PARA TI AGUANTE ARGENTINA
537,i literally cannot escape argentina wtf https://t.co/WJFhY42qMU,literally cannot escape argentina wtf tco WJFhY qMU
538,"Legalzinho esse jogo da copa do mundo, mas absurdo estarmos perdendo pra Argentina nele https://t.co/2hBn83e2Qn",Legalzinho esse jogo da copa mundo mas absurdo estarmos perdendo pra Argentina nele tco hBn e Qn
539,"Brasil x Argentina, Copa America, Neymar mostrou alí que se com ele for difícil, sem ele será pior. Então é bom sempre ter, pq se precisar de alguém que pegue a bola na defesa e percorra o campo até o gol, é só ele que fará https://t.co/0Jt7orCia3",Brasil x Argentina Copa America Neymar mostrou alí que se com ele difícil sem ele será pior Então é bom sempre ter pq se precisar de alguém que pegue bola na defesa e percorra campo até gol é só ele que fará tco Jt orCia
540,"@horaciorlarreta Hola Horacio! Querés que hagamos un relevamiento de cuántas hectáreas tiene tu familia? Por ahí, lo que necesita la Argentina es menos concentración de la tierra... ¿Que opinás?
Podemos sumar a otras familias, si querés...! 😜",horaciorlarreta Hola Horacio Querés que hagamos un relevamiento de cuántas hectáreas tiene tu familia Por ahí lo que necesita la Argentina es menos concentración de la tierra Que opinás Podemos sumar otras familias si querés
541,@Canelo Y que vas hacer cuando te encuentres a los pechos fríos de tu selección? Por falta de 🥚 en el campo contra una argentina sin piernas. Es para una tarea,Canelo Y que vas hacer cuando te encuentres los pechos fríos de tu selección Por falta de en el campo contra una argentina sin piernas Es para una tarea
542,@amobrejas Infelizmente a Argentina não teve sorte e caiu com a maior seleção da copa arabia saudita,amobrejas Infelizmente Argentina não teve sorte e caiu com maior seleção da copa arabia saudita
543,"@andrescfarfan Y quien te dijo que esta manga de delincuentes va a comprar algo??
Hay un verbo llamado ""viaticar"" y en Argentina lo conocen bien.
NO VAN A COMPRAR NI AVIONES DE PAPEL.",andrescfarfan Y quien te dijo que esta manga de delincuentes va comprar algo Hay un verbo llamado viaticar en Argentina lo conocen bienNO VAN A COMPRAR NI AVIONES DE PAPEL
544,"@ctvbarranquilla El único que defiende los colores en su deporte, lastimosamente la selección no lo hace en la cancha. Lo demás hay que darle crédito a la afición argentina solo tienen cuatro años en sentír alegría en el único deporte donde destacan. Ni F1 Ni Box ni una guerra pudieron ganar.",ctvbarranquilla El único que defiende los colores en su deporte lastimosamente la selección lo hace en la cancha Lo demás hay que darle crédito la afición argentina solo tienen cuatro años en sentír alegría en el único deporte donde destacan Ni F Ni Box ni una guerra pudieron ganar
545,@SebaRiver0 En inferiores la selección argentina es hija de México 😂😂😂😂😂,SebaRiver En inferiores la selección argentina es hija de México
546,"@Falso_Manager @Jon32962747 @valedemarotte1 @Canelo La pinché pulga está enana ! Atreverse a patear la playera de méxico 🇲🇽 es valer mierda , x que en méxico están muchos boludos argentinos de mierda jugando ya que en su pinche Argentina no les dan de tragar y menos jugar en sus equipos . Deberían ser agradecidos",Falso_Manager Jon valedemarotte Canelo La pinché pulga está enana Atreverse patear la playera de méxico es valer mierda x que en méxico están muchos boludos argentinos de mierda jugando ya que en su pinche Argentina les dan de tragar menos jugar en sus equipos Deberían ser agradecidos
547,@Monsem11_ @B0CAmivida12 @darhzz1 @TatoZanotti @Martinpdisalvo Y yo la patagonia de Chile.. perdón de Argentina,Monsem _ B CAmivida darhzz TatoZanotti Martinpdisalvo Y yo la patagonia de Chile perdón de Argentina
548,"🗣️ ""You neither know the person, nor do you understand how a locker room works."" 😡

Things are getting heated in what is a bizzare row between some football and boxing A-listers...

https://t.co/u4hkpRTcNW",You neither know person understand locker room works Things getting heated bizzare row football boxing A listers tco u hkpRTcNW
549,"Televisa 'anota' otro gol a TV Azteca: partido entre México y Argentina rompió récord de audiencia | #Qatar2022

https://t.co/wZMZSS6w7F https://t.co/SOWzWhiaTk",Televisa anota otro gol TV Azteca partido entre México Argentina rompió récord de audiencia Qatar tco wZMZSS w F tco SOWzWhiaTk
550,"@Iisacachorra @choquei Abriram as portas do fundamental 2

Karen, torce pra Argentina e é fã de pop ctrl c ctrl v de asiático, k",Iisacachorra choquei Abriram portas fundamental Karen torce pra Argentina e é fã de pop ctrl c ctrl v de asiático k
