,tweet,clean_tweet
0,"todos los becerros cuando maria becerra estrene su álbum ""LA NENA DE ARGENTINA"" https://t.co/32A6vpwebZ",todos los becerros cuando maria becerra estrene su álbum LA NENA DE ARGENTINA tco A vpwebZ
1,"@_LauraDiMarco De esos 20, tomando el período 2002-15 Argentina había conquistado el salario +alto en U$s de LatAm y (Dujovne dixit) ""deuda ridiculam. baja"" hasta q llegó el gángster mafioso #MacriMufa q NOS FUNDIÓ en deuda hasta el default y ahora te paga para mentir q fue otro q #MacriEsMufa",_LauraDiMarco De esos tomando el período Argentina había conquistado el salario alto en U de LatAm Dujovne dixit deuda ridiculam baja hasta q llegó el gángster mafioso MacriMufa q NOS FUNDIÓ en deuda hasta el default ahora te paga para mentir q fue otro q MacriEsMufa
2,"@azulado97 @edutorresr @Antonio_Nelli Nono, hipócrita sería si se hubiera ""disgustado"" por los goles de Argentina o celebrado los hipotéticos goles de México. Cerrando el comentario, para mí La Volpe es el único DT argentino medianamente conocido que siente realmente la bandera mexicana por encima de la argentina.",azulado edutorresr Antonio_Nelli Nono hipócrita sería si se hubiera disgustado por los goles de Argentina celebrado los hipotéticos goles de México Cerrando el comentario para mí La Volpe es el único DT argentino medianamente conocido que siente realmente la bandera mexicana por encima de la argentina
3,"@edufeiok Que es un chiste de mal gusto ,que este país es el reino del revés ,no hay caso argentina es un bello país pero la gente no sirve",edufeiok Que es un chiste de mal gusto que este país es el reino del revés hay caso argentina es un bello país pero la gente sirve
4,@Eldi2 @BrunoDigennaro9 @AlvaritoMorales Es solo un partido de fútbol que le tocó ganar a Argentina…para que involucrar otras cuestiones???…no hace falta muchachos…abrazo!,Eldi BrunoDigennaro AlvaritoMorales Es solo un partido de fútbol que le tocó ganar Argentina para que involucrar otras cuestiones hace falta muchachos abrazo
5,@kaeldelaj @brunoformiga Então a Suíça é melhor que a França e a Arábia Saudita é mais time que a Argentina campeã da Copa América.,kaeldelaj brunoformiga Então Suíça é melhor que França e Arábia Saudita é mais time que Argentina campeã da Copa América
6,"o problema é quando sai atrás do resultado, como contra a Bélgica e Argentina na copa América https://t.co/OdHatA5zRG",problema é quando sai atrás resultado como contra Bélgica e Argentina na copa América tco OdHatA zRG
7,@4ndyWS Si si pero no lleven al gato a los partidos de Argentina o serán la familia mufeti,ndyWS Si si pero lleven al gato los partidos de Argentina serán la familia mufeti
8,"También el economista definió que: El plan para que Argentina salga adelante no es negociable: implica una reforma del Estado, bajar el gasto público y un ajuste que en vez de caer sobre la gente caiga sobre la casta política"".",También el economista definió que El plan para que Argentina salga adelante es negociable implica una reforma del Estado bajar el gasto público un ajuste que en vez de caer sobre la gente caiga sobre la casta política
9,@bayernhost I just realised you wanted me to remove it because you want Argentina to win it loooool,bayernhost I realised wanted remove want Argentina win loooool
10,"⚽ Qatar 2022

💸 Piden 3000 dólares una entrada para Argentina vs. Polonia

🔴 Seguí #Argenzuela [EN VIVO] https://t.co/9fxDe5Kt8s https://t.co/oqxsn6z5T7",Qatar Piden dólares una entrada para Argentina vs Polonia Seguí Argenzuela EN VIVO tco fxDe Kt tco oqxsn z T
11,@SoySteveStifler Como rompen las bolas con que los k son mufas o que Mauricio es mufa o al lado de quien se sienta cada uno con los problemas que hay en Argentina A QUIEN CHOTA LE IMPORTA QUIEN ESTE EN EL ESTADIO!!!,SoySteveStifler Como rompen las bolas con que los k son mufas que Mauricio es mufa al lado de quien se sienta cada uno con los problemas que hay en Argentina A QUIEN CHOTA LE IMPORTA QUIEN ESTE EN EL ESTADIO
12,"@Adriananunezr y @LilaVanorio
muy buena la nota de los restaurantes... Muy buena. Lo del restó en la grúa, mamarracho...
y la carne en Vzla no es tan buena, ni la de Sta Bárbara. La Uruguaya es súper súper... y la de Argentina también y la de USA... USHHH se corta con el tenedor",Adriananunezr LilaVanoriomuy buena la nota de los restaurantes Muy buena Lo del restó en la grúa mamarrachoy la carne en Vzla es tan buena ni la de Sta Bárbara La Uruguaya es súper súper la de Argentina también la de USA USHHH se corta con el tenedor
13,"A Organizada da Argentina é fruto de um conglomerado de organizadas dos clubes de lá.
O Movimento Verde Amarelo tenta rejeitar associação com as nossas organizadas.

Por isso a La Guardia Imperial é foda e o MVA uma piada. https://t.co/muDp0cqW50",A Organizada da Argentina é fruto de um conglomerado de organizadas dos clubes de láO Movimento Verde Amarelo tenta rejeitar associação com nossas organizadasPor isso La Guardia Imperial é foda e MVA uma piada tco muDp cqW
14,"@iquetorbellino Quisiera tirarle hate a Argentina, pero de allá es el maestro Cerati. 😩🤌🏻",iquetorbellino Quisiera tirarle hate Argentina pero de allá es el maestro Cerati
15,"@nadanovonofront Argentina tem que ficar no lugar dela: primeira rodada. No mais, topo.",nadanovonofront Argentina tem que ficar lugar dela primeira rodada No mais topo
16,"@betobooks No soy argentina, pero me gustaría saber como llego a esa conclusión y por qué generaliza si en todos los países del mundo hay gente racista.",betobooks No soy argentina pero gustaría saber como llego esa conclusión por qué generaliza si en todos los países del mundo hay gente racista
17,@wooldon @mikey_esquire Show us when Argentina won the World Cup.,wooldon mikey_esquire Show us Argentina World Cup
18,"@quelopariobo2 Deja de renegar sintoniza la radio La Red de Argentina  y escucha el partido, suerte para tu selección, un abrazo desde Bs As Argentina 🇦🇷",quelopariobo Deja de renegar sintoniza la radio La Red de Argentina escucha el partido suerte para tu selección un abrazo desde Bs As Argentina
19,"@diegobranca uno de los mayores HDP de la Argentina. Ensobrado, ñoqui, chorro y delincuente. https://t.co/q0w5YbXktq",diegobranca uno de los mayores HDP de la Argentina Ensobrado ñoqui chorro delincuente tco q w YbXktq
20,"@Gabiroja1 Por favor, di que Arabia Saudita le gana a México y Argentina a Polonia, para que todo sea al revés 🤣",Gabiroja Por favor di que Arabia Saudita le gana México Argentina Polonia para que todo sea al revés
21,@futebol_info Imagem Maior que a Argentina,futebol_info Imagem Maior que Argentina
22,"@Winston_Dunhill que raro falta @LaRomiScalora y estamos todos, deberían tener vergüenza , en Argentina hay un 50% de pobreza y estos pánfilos tiran fotos como si fuesen héroes y no se dan cuenta que son unos garcas ensobrados",Winston_Dunhill que raro falta LaRomiScalora estamos todos deberían tener vergüenza en Argentina hay un de pobreza estos pánfilos tiran fotos como si fuesen héroes se dan cuenta que son unos garcas ensobrados
23,"Canelo venite a dar una vuelta para argentina, en una de esas te encontras con Messi lcdth",Canelo venite dar una vuelta para argentina en una de esas te encontras con Messi lcdth
24,"@CBF_Futebol @Casemiro Grande Brasil campeón...

Brasil padre natural y artificial de argentina 👏🤣 🔨👊",CBF_Futebol Casemiro Grande Brasil campeónBrasil padre natural artificial de argentina
25,@ferna2mil @eldestapeweb Parece que sufren de amnecia. O estuvieron fuera de Argentina cuando gobernó el sr reposera..sin pandemia y sin guerra,ferna mil eldestapeweb Parece que sufren de amnecia O estuvieron fuera de Argentina cuando gobernó el sr reposerasin pandemia sin guerra
26,@biblesumett @Buildbuilddd @beoncloud_th 💕🔥🇦🇷  Pasion Argentina por ustedes https://t.co/oPGdSnYJ6d,biblesumett Buildbuilddd beoncloud_th Pasion Argentina por ustedes tco oPGdSnYJ
27,"@Canelo Después de todo este circo que hacía una camiseta de México en el vestuario de argentina.?

Aaa y cuando quieras canelo no cruzamos 🤙💪",Canelo Después de todo este circo que hacía una camiseta de México en el vestuario de argentina Aaa cuando quieras canelo cruzamos
28,@FirstFalklands It’s got fuck all to do with Argentina who visits British territories.,FirstFalklands It got fuck Argentina visits British territories
29,"Me avisan desde oriente vía FAX sobre el FC-1 Thunder. 

Buenos vientos para la adquisición de FC-1 Thunder por parte de Argentina. Se prioriza la soberanía. 

Ampliaremos. https://t.co/BPQaYZu6wv",Me avisan desde oriente vía FAX sobre el FC Thunder Buenos vientos para la adquisición de FC Thunder por parte de Argentina Se prioriza la soberanía Ampliaremos tco BPQaYZu wv
30,"@ulixeneize_ @River_Historia @blasitobjs @astonpija @Mario___RM Respétate que sólo tenéis un mundial más y con trampitas.
Francia es más grande que Argentina de aquí a Saturno",ulixeneize _ River_Historia blasitobjs astonpija Mario___RM Respétate que sólo tenéis un mundial más con trampitasFrancia es más grande que Argentina de aquí Saturno
31,@GaviZeiro @choquei Queremos vc como ex cidadã brasileira meter o pé fora do meu país e morar lá na Argentina…,GaviZeiro choquei Queremos vc como ex cidadã brasileira meter pé fora meu país e morar lá na Argentina
32,"@osvwal La fabrica de pobres en argentina se llama peronismo y aliados tóxicos, todas las provincias gobernadas por peronistas es pobre, chaco era una provincia pujante y en 8 años los peronachos, la empobrecieron. EL PERONISMO ES EL MAL.",osvwal La fabrica de pobres en argentina se llama peronismo aliados tóxicos todas las provincias gobernadas por peronistas es pobre chaco era una provincia pujante en años los peronachos la empobrecieron EL PERONISMO ES EL MAL
33,@alciraque Ese Canelo🤬 kiere protagonismo. Un billon de Messianos🇦🇷🇦🇷🇦🇷🇦🇷 listos para defenderlo #Argentina 👏👏👏👏👏👏,alciraque Ese Canelo kiere protagonismo Un billon de Messianos listos para defenderlo Argentina
34,"me desmayoooo, viene the weekend a la argentina aaaaaa",desmayoooo viene weekend la argentina aaaaaa
35,"Octavos de final sera 

Paises Bajos V Usa
Inglatera Vs Ecuador 

Argentina Vs Dinamarca
Francia Vs Polonia

España Vs Bélgica 
Japon vs Croacia

Brasil vs Portugal
Suiza vs Uruguay",Octavos de final sera Paises Bajos V UsaInglatera Vs Ecuador Argentina Vs DinamarcaFrancia Vs PoloniaEspaña Vs Bélgica Japon vs CroaciaBrasil vs PortugalSuiza vs Uruguay
36,"@Syodus Mas nois tava sem nosso principal jogador (se a Argentina joga sem Messi contra o México o jogo é 0x0), e os caras que entraram foram bem: Bruno, Rodrygo, Antony

E os jogadores de trás fazem grandes jogos Alex Sandro, casemiro, Thiago Silva e marquinhos",Syodus Mas nois tava sem nosso principal jogador se Argentina joga sem Messi contra México jogo é x e os caras que entraram foram bem Bruno Rodrygo AntonyE os jogadores de trás fazem grandes jogos Alex Sandro casemiro Thiago Silva e marquinhos
37,@Canelo lo bueno que existe un Dios grande y poderoso que hace justicia...Ahora nos tocará ver la caída brutal de Argentina... porque el que se ensalsa y es orgulloso Dios lo humilla🙏,Canelo lo bueno que existe un Dios grande poderoso que hace justiciaAhora nos tocará ver la caída brutal de Argentina porque el que se ensalsa es orgulloso Dios lo humilla
38,"Si, ganamos el partido clave ante México ⚽️y ahora la Selección Argentina depende de sí misma para llegar a octavos de final de Qatar 2022 🇦🇷 Este miércoles se viene Polonia y hay que dejarlo todo 👊

la columna competa de @Lucasitzer 
👉https://t.co/VEEIBoVbOl https://t.co/sNcy7CQgRt",Si ganamos el partido clave ante México ahora la Selección Argentina depende de sí misma para llegar octavos de final de Qatar Este miércoles se viene Polonia hay que dejarlo todo la columna competa de Lucasitzer tco VEEIBoVbOl tco sNcy CQgRt
39,"@DF1Lagoa @inakiangulo Necesitas una defensa muy sólida en bloque bajo 

Y España no tiene ese tipo de jugadores 

Esos jugadores están en Francia en argentina en Brasil 

Por eso juegan a transicionar 

Alemania te va arriba y juega a lo mismito que España y es probable que gane el mundial",DF Lagoa inakiangulo Necesitas una defensa muy sólida en bloque bajo Y España tiene ese tipo de jugadores Esos jugadores están en Francia en argentina en Brasil Por eso juegan transicionar Alemania te va arriba juega lo mismito que España es probable que gane el mundial
40,"“En Argentina, entender sobre todo al empresario grande, a aquél que comanda compañías nacionales o extranjeras que cumplen una función importante en los mercados, es ciertamente complejo.” https://t.co/CQbMBgdDi6",En Argentina entender sobre todo al empresario grande aquél que comanda compañías nacionales extranjeras que cumplen una función importante en los mercados es ciertamente complejo tco CQbMBgdDi
41,@Canelo No  patea la playera canelo se le quedó enganchada después de la patada que les dio en el chiquito pinché joto jajajajaja aguante argentina caraja y deparó saludo a los de TNT SPORT JAJAJA sigan metiéndose con messi que se las va a seguir metiendo jajajaja,Canelo No patea la playera canelo se le quedó enganchada después de la patada que les dio en el chiquito pinché joto jajajajaja aguante argentina caraja deparó saludo los de TNT SPORT JAJAJA sigan metiéndose con messi que se las va seguir metiendo jajajaja
42,"“toda latinoamérica odia a los mexicanos” WHO’S WE? la mayoría odia a argentina y entre ellos en sí, no eres alt, eres estúpido-",toda latinoamérica odia los mexicanos WHO S WE la mayoría odia argentina entre ellos en sí eres alt eres estúpido
43,@casper_sl Pero claro. Yo creo que todos los problemas de Argentina se solucionan con ramas de ruda macho...,casper_sl Pero claro Yo creo que todos los problemas de Argentina se solucionan con ramas de ruda macho
44,"@jgynmyluv ganó argentina el sábado, reviví",jgynmyluv ganó argentina el sábado reviví
45,"@Spidey_Hood @FortniteGame Pan dulce
I don't know 
Argentina buenos aires reverendo padre fhay don't dox me",Spidey_Hood FortniteGame Pan dulceI know Argentina buenos aires reverendo padre fhay dox
46,"@FelipeS07308365 @hevertonfutebol Não, bobo... Grupo forte é o da Inglaterra. Grupo forte é o da Alemanha, com Japão e Costa Rica. Grupo forte é o da França, com Austrália e Tunísia. Grupo forte é o da Argentina, com Arábia Saudita, México e Polônia... Grupo forte é o da Bélgica, com Marrocos e Canadá 👍🏽",FelipeS hevertonfutebol Não bobo Grupo forte é da Inglaterra Grupo forte é da Alemanha com Japão e Costa Rica Grupo forte é da França com Austrália e Tunísia Grupo forte é da Argentina com Arábia Saudita México e Polônia Grupo forte é da Bélgica com Marrocos e Canadá
47,@FIFAcom @Argentina Love u messi,FIFAcom Argentina Love u messi
48,"Vecna vendo Will, Max e Lucas com a camisa da Argentina https://t.co/UuhBkLUIAQ",Vecna vendo Will Max e Lucas com camisa da Argentina tco UuhBkLUIAQ
49,"Los que tienen guita hacen feria para vender sus cosas usadas, tipo si ellos están cagados... estamos muertos. 
Argentina.",Los que tienen guita hacen feria para vender sus cosas usadas tipo si ellos están cagados estamos muertos Argentina
50,"@_lisabodyguard_ @zainaccent @WavySwey @PopBase messi is good indeed, just no world cup in his very last one 😭 continues to cry argentina",_lisabodyguard_ zainaccent WavySwey PopBase messi good indeed world cup last one continues cry argentina
51,Escucharemos nuevas ideas de altos ejecutivos de @Vrio @DIRECTVLA y @Globant y del @AmChamArgentina sobre como ampliar la oferta laboral en el sector tecnológico en Argentina y en otros países latinoamericanos.,Escucharemos nuevas ideas de altos ejecutivos de Vrio DIRECTVLA Globant del AmChamArgentina sobre como ampliar la oferta laboral en el sector tecnológico en Argentina en otros países latinoamericanos
52,@Canelo Tanto respetas México que escribiste Argentina con mayúscula y México en minúsculas y sin tilde…. 👀,Canelo Tanto respetas México que escribiste Argentina con mayúscula México en minúsculas sin tilde
53,"Latinoamérica ha experimentado una aceleración hacia la digitalización. Pero el futuro de la transformación es incierto como resultado de retos como la limitada mano de obra digital. Mañana exploramos soluciones con líderes del sector tecnológico.

https://t.co/zReIwLYinJ",Latinoamérica ha experimentado una aceleración hacia la digitalización Pero el futuro de la transformación es incierto como resultado de retos como la limitada mano de obra digital Mañana exploramos soluciones con líderes del sector tecnológico tco zReIwLYinJ
54,A partir de este momento quiero tanto a Bangladesh como a Argentina. https://t.co/iQnoWEpF45,A partir de este momento quiero tanto Bangladesh como Argentina tco iQnoWEpF
55,che si argentina juega el sábado me imagino que van a pasar el partido por las pantallas del estadio no? perdón harry pero primero está la selección,che si argentina juega el sábado imagino que van pasar el partido por las pantallas del estadio perdón harry pero primero está la selección
56,"cada set que vuelvo a escuchar de @dj_dnox me pone cada vez más manija. próxima fecha en Argentina sea donde sea, voy",cada set que vuelvo escuchar de dj_dnox pone cada vez más manija próxima fecha en Argentina sea donde sea voy
57,américa latina menos argentina vamos https://t.co/GQ0e4w3ead,américa latina menos argentina vamos tco GQ e w ead
58,@FIFAcom @Argentina Love Bangladesh love Argentina love Muslim,FIFAcom Argentina Love Bangladesh love Argentina love Muslim
59,Need East Argentina 🇺🇾 to get the W,Need East Argentina get W
60,"World Cup # Qatar2022

Souvenirs 

Group C Round 1 

Argentina 1-2 Saudi

Pologne 0-0 Mexico https://t.co/FJVr4oiovC",World Cup Qatar Souvenirs Group C Round Argentina SaudiPologne Mexico tco FJVr oiovC
61,@Angel_Rsz98 @Alvamrtnz Con su fortuna compra argentina y las Malvinas,Angel_Rsz Alvamrtnz Con su fortuna compra argentina las Malvinas
62,"@CarlosMaslaton Carlos, si incluye pasaje a Qatar y entradas para futuros partidos de Argentina, estoy interesado.",CarlosMaslaton Carlos si incluye pasaje Qatar entradas para futuros partidos de Argentina estoy interesado
63,"⚽️Con Messi y clima alegre, Argentina se entrenó pero Scaloni no dio pistas del equipo https://t.co/ahSKEv8EAT",Con Messi clima alegre Argentina se entrenó pero Scaloni dio pistas del equipo tco ahSKEv EAT
64,"@tlo_thiag0 Sim meu ponto é que isso provavelmente não vai se repetir porque foi exatamente assim em 18, tomaram pressão da Argentina por subestimar o oponente e dominaram os outros 3 jogos 

Ja isso que aconteceu com o Brasil não tenho tanta certeza",tlo_thiag Sim meu ponto é que isso provavelmente não vai se repetir porque foi exatamente assim em tomaram pressão da Argentina por subestimar oponente e dominaram os outros jogos Ja isso que aconteceu com Brasil não tenho tanta certeza
65,".
Chairo:  

Que te decepciono más:

a)  El partido Mexico vs Argentina del mundial  (perdimos 2 - 0)

b)  La procesión de AMLO más de 2 mil camiones de acarreados y nunca se pudo llenar el zócalo

Caray que mal fin de semana
. https://t.co/5JOsOGgryx",Chairo Que te decepciono mása El partido Mexico vs Argentina del mundial perdimos b La procesión de AMLO más de mil camiones de acarreados nunca se pudo llenar el zócaloCaray que mal fin de semana tco JOsOGgryx
66,Algunas personas sacan de contexto mis comentarios..... dije que pasaría si Argentina tuviera un equipo de fútbol ⚽ mediocre que nunca ganará nada....,Algunas personas sacan de contexto mis comentarios dije que pasaría si Argentina tuviera un equipo de fútbol mediocre que nunca ganará nada
67,@santty1891 @GraciasVirrey0 Pense q habia dicho algo de argentina 😔,santty GraciasVirrey Pense q habia dicho algo de argentina
68,"@SebastianaB Tranquilos,Argentina solo llega a 8vo de final y el Sr Messi vera su retiro sin ser campeón del mundo",SebastianaB TranquilosArgentina solo llega vo de final el Sr Messi vera su retiro sin ser campeón del mundo
69,QM POSTA FOTO COM CAMISA DA ARGENTINA NN TEM O DIREITO DE USAR A DO BRASIL https://t.co/I023wQaW12,QM POSTA FOTO COM CAMISA DA ARGENTINA NN TEM O DIREITO DE USAR A DO BRASIL tco I wQaW
70,"Por $1,000.00 vitoreo hasta a Argentina. https://t.co/i6pdpgQXZr",Por vitoreo hasta Argentina tco pdpgQXZr
71,Fuerte apuesta de Argentina en París para que Bariloche sea la sede de la Expo Internacional Especializada 2027 https://t.co/nUl3yDv47m,Fuerte apuesta de Argentina en París para que Bariloche sea la sede de la Expo Internacional Especializada tco nUl yDv
72,que oso marica brasil ni español hablan y se ríen con la k? aguante argentina https://t.co/2rpWJDj5P7,que oso marica brasil ni español hablan se ríen con la k aguante argentina tco rpWJDj P
73,#MacriMufa     #MacriMufa   #MacriMufa   FIRMES   HASTA EL MIÉRCOLES  DESPUÉS QUE    TERMINE   ARGENTINA  /POLONIA...QUE EMPIEZA  14:00 HA.,MacriMufa MacriMufa MacriMufa FIRMES HASTA EL MIÉRCOLES DESPUÉS QUE TERMINE ARGENTINA POLONIAQUE EMPIEZA HA
74,@md_jinn What about Argentina &amp; Poland match MD???,md_jinn What Argentina amp Poland match MD
75,"@daniellziraldo @4RC4N1 https://t.co/Z7p3GAUl7L el 40% del ejercito de San Martin era negro, y asi siguio siendo hasta la guerra del Paraguay",daniellziraldo RC N tco Z p GAUl L el del ejercito de San Martin era negro asi siguio siendo hasta la guerra del Paraguay
76,"@shop350 @synthpreacher @MGnano2k @miseleccionmx @Lc24C No creo que pierda México, al menos no debería, salvo que el tata ponga la misma formación que tuvo contra argentina",shop synthpreacher MGnano k miseleccionmx Lc C No creo que pierda México al menos debería salvo que el tata ponga la misma formación que tuvo contra argentina
77,"Incredible scene in the match of between Argentina and Mexico at Dhaka University, Bangladesh! 🙂🇧🇩
#ArgentinavsMexico https://t.co/aUHvMWlBUD https://t.co/vRwVqAN1o6",Incredible scene match Argentina Mexico Dhaka University Bangladesh ArgentinavsMexico tco aUHvMWlBUD tco vRwVqAN
78,"and Argentina 👀
https://t.co/MyJDsRdENE https://t.co/Z8ATPMNuNv",Argentina tco MyJDsRdENE tco Z ATPMNuNv
79,enquanto isso a argentina comemorando por vencer a várzea mexicana https://t.co/OsahHN8f1p,enquanto isso argentina comemorando por vencer várzea mexicana tco OsahHN f p
80,#QatarWorldCup2022 🇶🇦 ⚽ | Podrían deportar de Catar a un jugador de la selección argentina de fútbol por presunto abuso sexual https://t.co/nnF6ldsQ0n,QatarWorldCup Podrían deportar de Catar un jugador de la selección argentina de fútbol por presunto abuso sexual tco nnF ldsQ n
81,"@rolandosenpay @leocanagasaya @Amyyfontao @YorYo8103 @Wilson_Torres01 @mor_lorraine @ElVatoLoc0 Una la ganó Brasil y la otra Argentina. Y no, no te puedo decir por qué la ganó. No soy argentina y era muy chica en el 86. Pero vi el partido del sábado y los mexicanos son más sucios que una papa negra. De modo que podés ir guardándote tus apreciaciones.",rolandosenpay leocanagasaya Amyyfontao YorYo Wilson_Torres mor_lorraine ElVatoLoc Una la ganó Brasil la otra Argentina Y te puedo decir por qué la ganó No soy argentina era muy chica en el Pero vi el partido del sábado los mexicanos son más sucios que una papa negra De modo que podés ir guardándote tus apreciaciones
82,"@FelipeS07308365 @hevertonfutebol Não, bobo... Grupo forte é o da Inglaterra. Grupo forte é o da Alemanha, com Japão e Costa Rica. Grupo forte é o da França, com Austrália e Tunísia. Grupo forte é o da Argentina, com Arábia Saudita, México e Polônia... Grupo forte é o da Bélgica, com Marrocos e Canadá 👍🏽",FelipeS hevertonfutebol Não bobo Grupo forte é da Inglaterra Grupo forte é da Alemanha com Japão e Costa Rica Grupo forte é da França com Austrália e Tunísia Grupo forte é da Argentina com Arábia Saudita México e Polônia Grupo forte é da Bélgica com Marrocos e Canadá
83,@FIFAcom @Argentina Love u messi,FIFAcom Argentina Love u messi
84,"Vecna vendo Will, Max e Lucas com a camisa da Argentina https://t.co/UuhBkLUIAQ",Vecna vendo Will Max e Lucas com camisa da Argentina tco UuhBkLUIAQ
85,"Los que tienen guita hacen feria para vender sus cosas usadas, tipo si ellos están cagados... estamos muertos. 
Argentina.",Los que tienen guita hacen feria para vender sus cosas usadas tipo si ellos están cagados estamos muertos Argentina
86,"@_lisabodyguard_ @zainaccent @WavySwey @PopBase messi is good indeed, just no world cup in his very last one 😭 continues to cry argentina",_lisabodyguard_ zainaccent WavySwey PopBase messi good indeed world cup last one continues cry argentina
87,Escucharemos nuevas ideas de altos ejecutivos de @Vrio @DIRECTVLA y @Globant y del @AmChamArgentina sobre como ampliar la oferta laboral en el sector tecnológico en Argentina y en otros países latinoamericanos.,Escucharemos nuevas ideas de altos ejecutivos de Vrio DIRECTVLA Globant del AmChamArgentina sobre como ampliar la oferta laboral en el sector tecnológico en Argentina en otros países latinoamericanos
88,@Canelo Tanto respetas México que escribiste Argentina con mayúscula y México en minúsculas y sin tilde…. 👀,Canelo Tanto respetas México que escribiste Argentina con mayúscula México en minúsculas sin tilde
